ID,Date,Author,Target,Description,Attack,Target Class,Attack Class,Country,Link,Tags
450,03/07/2017,?,Google,"In the wake of the breach occurred to Sabre Hospitality Solutions earlier in May, the personal details of a small number of Google staffers have been exposed, according to a notification letter Google sends out to affected employees.",Account Hijacking,J Information and communication,CC,US,https://www.bleepingcomputer.com/news/security/data-of-google-employees-exposed-in-sabre-breach/,"Sabre Hospitality Solutions, Google"
451,06/07/2017,?,Hard Rock Hotels & Casinos,"Another consequence of the Sabre breach, Hard Rock Hotels and & Casinos reveals that for seven months, attackers had unauthorized access to a third-party reservation system, which allowed them to attain unencrypted credit card payment information, as well as guest names, addresses and phone numbers.",Account Hijacking,I Accommodation and food service activities,CC,US,http://www.marketwatch.com/story/hard-rock-hotels-casinos-notifies-guests-of-third-party-vendor-security-incident-2017-07-06?siteid=nbkh,"Hard Rock Hotels & Casinos, Sabre Hospitality Systems"
452,06/07/2017,?,Loews Hotels,And the same happens for luxury hotel chain Loews Hotels.,Account Hijacking,I Accommodation and food service activities,CC,US,http://www.nbcphiladelphia.com/news/local/Loews-Hotels-Warns-Customers-of-Data-Breach-432998953.html,"Loews Hotels, Sabre Hospitality Systems"
453,06/07/2017,?,Four Seasons Hotels and Resorts,And the list of the victims of the Sabre attack also includes Four Seasons Hotels and Resorts.,Account Hijacking,I Accommodation and food service activities,CC,US,http://www.fourseasons.com/content/dam/fourseasons/web/pdfs/Notice%20of%20Sabre%20Data%20Security%20Incident%20Impacting%20Guest%20Payment%20Card%20Information%20(6867562x7AB84).pdf,"Four Seasons Hotels and Resorts, Sabre Hospitality Systems"
454,06/07/2017,?,Android Devices,"Check Point reveals the details of CopyCat, a new strain of a malware that has infected more than 14 million Android devices around the world, rooting phones and hijacking apps to make millions in fraudulent ad revenue.",Malware,X Individual,CC,>1,https://www.cnet.com/uk/news/android-hack-copycat-malware-device-outdated-14-million/,"Check Point, CopyCat, Android"
455,06/07/2017,?,Android Devices,"Trend Micro reveals the details of SLocker, a variant of the oldest lock-screen and file-encrypting, using the WannaCry interface.",Malware,X Individual,CC,>1,https://www.infosecurity-magazine.com/news/slocker-variant-nabs-wannacry/,"Trend Micro, SLocker, WannaCry"
456,07/07/2017,?,gandi.net,"French domain registrar Gandi loses control over 751 customer domains, which have their DNS records altered to point incoming traffic to websites hosting exploits kits.",DNS Hijacking,J Information and communication,CC,FR,https://www.bleepingcomputer.com/news/security/751-domains-hijacked-to-redirect-traffic-to-exploit-kits/,Gandi
457,07/07/2017,?,B&B Theatres,"B&B Theatres, a company that owns and operates the 7th-largest theater chain in America, says it is investigating a breach of its credit card systems starting in September 2015.",Malware,R Arts entertainment and recreation,CC,US,https://krebsonsecurity.com/2017/07/bb-theatres-hit-in-2-year-credit-card-breach/,B&B Theatres
458,07/07/2017,?,"Critical infrastructure and energy companies around the world, primarily in Europe and the United States","Talos reveals the details of an email-based attack targeting the energy sector, including nuclear power for multiple energy companies around the world, primarily in Europe and the US.",Targeted Attack,D Electricity gas steam and air conditioning supply,CE,>1,http://blog.talosintelligence.com/2017/07/template-injection.html#more,Talos
459,08/07/2017,?,Avanti Markets,"Avanti Markets, a self-service payment kiosks vendors acknowledges to have suffered of breach of its internal networks in which hackers were able to push malicious software out to payment devices.",Malware,C Manufacturing,CC,US,https://krebsonsecurity.com/2017/07/self-service-food-kiosk-vendor-avanti-hacked/,Avanti Markets
460,08/07/2017,?,Deep Hosting,"Deep Hosting, a Dark Web hosting service, admits to have suffered a major security incident during which ""some sites have been exported""",Remote Shell,G Wholesale and retail trade,CC,N/A,https://www.bleepingcomputer.com/news/security/dark-web-hosting-service-hacked-some-data-was-stolen/,Deep Hosting
461,09/07/2017,?,Reliance Jio,Personal details of some 120 Million Reliance Jio customers are exposed on the Internet in probably the biggest breach of personal data ever in India.,Unknown,J Information and communication,CC,IN,http://www.zdnet.com/article/indias-reliance-jio-suffers-data-breach-report/,Reliance Jio
462,09/07/2017,?,Real Estate Business Services (REBS),"Real Estate Business Services (REBS), a subsidiary of the California Association of Realtors, acknowledges to have suffered a data breach that exposed user information for a two-month period earlier this year.",PoS Malware,L Real estate activities,CC,US,https://www.scmagazine.com/data-breach-hits-california-association-of-realtors/article/673795/,"Real Estate Business Services, REBS, California Association of Realtors"
463,10/07/2017,?,Swiss Banks,"Researchers from Trend Micro discover a new variant of the Operation Emmental, targeting the Swiss banks using a variant of the DoK Mac OS X malware.",Malware,K Financial and insurance activities,CC,CH,http://securityaffairs.co/wordpress/60869/apt/dok-malware-operation-emmental.html,"Trend Micro, Operation Emmental"
464,10/07/2017,?,Android Devices,"Researchers from McAfee reveal the details of a mobile ransomware known as LeakerLocker, threatening to dox users as a mean of extortion.",Malware,X Individual,CC,>1,https://www.grahamcluley.com/leakerlocker-ransomware-threatens-to-dox-android-users-as-extortion/,"McAfee, LeakerLocker"
465,11/07/2017,?,Trump International Hotels Management,"Trump International Hotels Management reveals that the data breach to Sabre Corp, occurred in May 2017, compromised card payment details at 14 of its properties. The compromised information included payment card numbers and card security codes for some of the hotel chain's reservations.",Malware,I Accommodation and food service activities,CC,US,https://uk.reuters.com/article/us-trumphotels-cyber-idUKKBN19X2G2,"Trump International Hotels Management, Sabre Corp."
466,11/07/2017,?,Single Individuals,"Trend Micro reveals the details of a surging campaign using a remote access tool (RAT) known as Adwind, which has the ability to steal passwords, collect keystrokes and covertly record audio using an infected device's microphone.",Malware,X Individual,CC,US,http://www.ibtimes.co.uk/password-stealing-adwind-malware-surges-across-world-new-spam-campaign-1630195,"Trend Micro, Adwind"
467,11/07/2017,?,Mansfield 103.2,"The UK Communications Regulator (Ofcom) is hunting a pirate who persistently overrides frequency of Mansfield 103.2 to play a modified version of ""The Winker’s Song"".",Unknown,J Information and communication,CC,UK,https://www.theguardian.com/tv-and-radio/2017/jul/11/local-radio-station-mansfield-hijacked-masturbation-winkers-song,"Ofcom, Mansfield 103.2, The Winker’s Song"
468,11/07/2017,?,Community Care of St. Catharines and Thorold,Community Care of St. Catharines and Thorold notifies to be still recovering from a cyberattack that shut its computers down for more than a week.,Malware,Q Human health and social work activities,CC,US,https://www.databreaches.net/ca-community-care-discloses-ransomware-incident/,"Community Care of St. Catharines and Thorold, Ransomware"
469,13/07/2017,?,Unfinished Wordpress Installations,Researchers from security firm Wordfence say they have observed a wave of web attacks that took aim at unfinished WordPress installations.,Account Hijacking,X Individual,CC,>1,https://www.bleepingcomputer.com/news/security/hackers-are-using-automated-scans-to-target-unfinished-wordpress-installs/,"Wordfence, Wordpress"
470,14/07/2017,?,Square Enix,Square Enix attributes the connectivity issues that have plagued Final Fantasy 14's Stormblood expansion since its release in June on continuous distributed denial-of-service (DDoS) attacks from a third party.,DDoS,R Arts entertainment and recreation,CC,JP,http://na.finalfantasyxiv.com/lodestone/news/detail/943f91bc27073dba50f8e848ce2c73ef704df951,"Square Enix, Final Fantasy 14"
471,14/07/2017,?,Peachtree Neurological Clinic,"While investigating a ransomware incident, Peachtree Neurological Clinic discovers that its computer system previously had been accessed without its knowledge by unauthorized individuals between February 2016 and May 2017.",Unknown,Q Human health and social work activities,CC,US,https://www.databreaches.net/atlanta-neurological-clinic-notifies-patients-of-ransomware-attack-and-an-older-hack/,"Peachtree Neurological Clinic, ransomware"
472,15/07/2017,?,Republic of Ireland’s Power Grid,"The Times reveals that hackers backed by the Russian government have attacked energy networks running the national grid in parts of the UK. In particular the hackers targeted the Republic of Ireland’s energy sector, aiming to infiltrate control systems",Targeted Attack,D Electricity gas steam and air conditioning supply,CW,UK,https://www.thetimes.co.uk/edition/news/russia-backed-hackers-try-to-hijack-britain-s-power-supply-55bj9790r,"Russia, Ireland"
473,16/07/2017,?,South Carolina's Voter Registration System,"According to a post-election report by the South Carolina State Election Commission, South Carolina's voter registration system was reportedly hit by almost 150,000 hack attempts on Election Day 2016.",>1,"O Public administration and defence, compulsory social security",CW,US,https://www.wsj.com/articles/south-carolina-may-prove-a-microcosm-of-u-s-election-hacking-efforts-1500202806,"South Carolina State Election Commission, Election Day"
474,16/07/2017,?,Twitter users,"ZeroFOX Threat Research reveal the details of a large-scale, spam pornography botnet on Twitter dubbed SIREN",Account Hijacking,X Individual,CC,>1,https://www.zerofox.com/blog/inside-massive-siren-social-network-spam-botnet/,"SIREN, Twitter"
475,17/07/2017,?,UK Energy Sector,"The National Cyber Security Centre (NCSC), part of the UK's intelligence agency GCHQ, issues a warning about hackers targeting the country's energy sector, and says that some industrial control system organizations are likely to have been successfully compromised.",Targeted Attack,D Electricity gas steam and air conditioning supply,CW,UK,https://motherboard.vice.com/en_us/article/9kwg4a/gchq-says-hackers-have-likely-compromised-uk-energy-sector-targets,"National Cyber Security Centre, NCSC, GCHQ"
476,17/07/2017,?,CoinDash,An unknown hacker takes over the official website of the CoinDash platform and modifies an Ethereum wallet address during the company's ICO (Initial Coin Offering) being able to steal $7 million worth of Ethereum.,Unknown,V Fintech,CC,US,https://www.bleepingcomputer.com/news/security/hacker-steals-7-million-worth-of-ethereum-from-coindash-platform/,"CoinDash, Ethereum"
477,17/07/2017,?,Android Users,"Trend Micro reveals the details of GhostCtrl, an Android malware able to take control of devices to spy, steal and do its bidding.",Malware,X Individual,CC,>1,http://blog.trendmicro.com/trendlabs-security-intelligence/android-backdoor-ghostctrl-can-silently-record-your-audio-video-and-more/,"Trend Micro, GhostCtrl, Android"
478,17/07/2017,?,Customers of international and U.S.-based financial institutions.,"Researchers from Flashpoint observe a new, Necurs-powered Trickbot spam campaign developed to target and infect customers of international and U.S.-based financial institutions.",Malware,K Financial and insurance activities,CC,>1,https://www.flashpoint-intel.com/blog/trickbot-targets-us-financials/,"Flashpoint, Necurs, Trickbot"
479,18/07/2017,?,Women’s Health Care Group of PA (WHCGPA),"Women’s Health Care Group of PA (WHCGPA) reveals to have been hit by ransomware on May 16, 2017. 300,000 patient records are affected.",Malware,Q Human health and social work activities,CC,US,https://www.hackread.com/healthcare-clinic-suffers-ransomware-attack-300k-patients-impacted/,"Women’s Health Care Group of PA, WHCGPA, ransomware"
480,18/07/2017,?,KQED,"KQED, a San Francisco radio station is still recovering from a ransomware attack, nearly one month after.",Malware,J Information and communication,CC,US,http://www.sfchronicle.com/business/article/Ransomware-attack-puts-KQED-in-low-tech-mode-11295175.php,"KQED, ransomware"
481,18/07/2017,?,Sarah Hyland,Nude photos and video of Sarah Hyland are leaked online.,Account Hijacking,X Individual,CC,US,https://www.gossipcop.com/sarah-hyland-nude-photos-video-leak-hack-legal-action/,Sarah Hyland
482,19/07/2017,DarkHotel,Political figures and senior business users,"Bitdefender reveals a new high-level spear-phishing attack targeting political figures and senior business users. Dubbed 'Inexsmar', the attack appears to be operated by the DarkHotel group, which has been perpetrating similar threats since 2007.",Targeted Attack,X Individual,CE,>1,https://www.theinquirer.net/inquirer/news/3014129/darkhotel-20-inexsmar-attack-targets-politicians-via-hotel-wifi,"Bitdefender,Inexsmar, DarkHotel"
483,19/07/2017,?,Individuals using Parity's Ethereum wallet,"A vulnerability in Parity's Ethereum wallet software is exploited by thieves to rob victims on a massive scale. Targeted accounts are drained of 150,000 coins worth just over US$30 million at the current price.",Vulnerability,X Individual,CC,>1,https://www.theregister.co.uk/2017/07/20/us30_million_below_parity_ethereum_bug_leads_to_big_coin_heist/,"Parity, Ethereum"
484,19/07/2017,?,Loblaws,"According to an email sent out to Loblaws account holders, the security of a ‘small number’ of accounts has been compromised, marking the second time the company has suffered a security breach this year. Comprised websites include Loblaws.ca, Joefresh.com and Beautyboutique.ca, as well as other Loblaws grocery chain websites.",Unknown,G Wholesale and retail trade,CC,CA,https://mobilesyrup.com/2017/07/19/loblaws-suffers-another-security-breach/,"Loblaws, Loblaws.ca, Joefresh.com, Beautyboutique.ca"
485,20/07/2017,?,Kansas Department of Commerce,A security breach in the Kansas Department of Commerce exposes millions of Social Security numbers from people across 10 states to hackers. Many other accounts are also attacked.,Unknown,"O Public administration and defence, compulsory social security",CC,US,http://kcur.org/post/hackers-kansas-system-accessed-social-security-numbers-millions-10-states#stream/0,Kansas Department of Commerce
486,20/07/2017,?,Newcastle University,"Newcastle University issues an alert, warning prospective students to be careful when seeking to apply and pay online for courses, after discovering the existence of a sophisticated phishing scam.",Account Hijacking,P Education,CC,UK,http://www.ibtimes.co.uk/newcastle-university-plagued-by-fake-phishing-site-that-accepts-payment-courses-1631260,Newcastle University
487,20/07/2017,?,Android Users,"According to a new report released by ESET, over 500,000 users have had their computers infected with a stealthy malware named Stantinko.",Malware,X Individual,CC,>1,https://www.bleepingcomputer.com/news/security/stantinko-modular-backdoor-infected-over-500-000-computers/,"ESET, Stantinko"
488,21/07/2017,?,Bank of America customers,A new campaign targets Bank of America customers via emails pretending to be from representatives of the Bank of America.,Account Hijacking,K Financial and insurance activities,CC,US,https://www.hackread.com/bank-of-america-phishing-scam/,Bank of America
489,21/07/2017,?,University of Vermont Medical Center,"University of Vermont Medical Center notifies 2,300 patients of a phishing incident occurred back in May 2017.",Account Hijacking,Q Human health and social work activities,CC,US,https://www.databreaches.net/university-of-vermont-medical-center-notifies-2300-patients-of-phishing-incident/,University of Vermont Medical Center
490,23/07/2017,chikri95,Kylie Jenner's Snapchat account,Kylie Jenner's Snapchat account is hacked. The attacker claims to reveal nude pictures.,Account Hijacking,X Individual,CC,US,http://www.dailymail.co.uk/tvshowbiz/article-4723166/Kylie-Jenner-s-Snapchat-HACKED.html,"Kylie Jenner, Snapchat, chikri95"
491,23/07/2017,@headassgang,Victoria Justice's Twitter account,Victoria Justice's Twitter account is hacked. The attacker claims to reveal nude pictures.,Account Hijacking,X Individual,CC,US,https://www.gossipcop.com/victoria-justice-twitter-hacked-tweets/,"Victoria Justice, @headassgang"
492,24/07/2017,?,Veritaseum,"Another day another Ethereum related breach. This time the target is Veritaseum, whose Initial Coin Offering (ICO) suffers a data breach in which around US$8.4 million worth of Ethereum are stolen.",Unknown,V Fintech,CC,US,https://www.hackread.com/veritaseum-hack-another-ethereum-ico-hacked-loses-84m/,"Veritaseum, Ethereum"
493,24/07/2017,Spring Dragon,Some high-profile organizations around the South China Sea.,Kaspersky Lab reveals the details of a new wave of attacks carried on by a long running APT actor dubbed Spring Dragon.,Targeted Attack,Y Multiple targets,CE,CN,http://securityaffairs.co/wordpress/61328/apt/spring-dragon-apt.html,"Kaspersky Lab, Spring Dragon"
494,25/07/2017,?,"Over 110,000 people from Edinburgh","Cybercriminals have reportedly been found selling personal information of over 110,000 people from Edinburgh on an unspecified dark web marketplace",Unknown,"O Public administration and defence, compulsory social security",CC,UK,http://www.ibtimes.co.uk/over-100000-ids-edinburg-sale-dark-web-1631799,Edinburgh
495,25/07/2017,Logan,Over 40 million US voter records,"A dark web vendor is reportedly selling over 40 million US voter records from nine states in an underground market called RaidForums. The data being sold allegedly includes full names, addresses, voter IDs, voter status and party affiliations.",Account Hijacking,"O Public administration and defence, compulsory social security",CC,US,http://www.ibtimes.co.uk/dark-web-criminal-selling-over-40-million-voter-records-9-us-states-under-5-1631842,"Logan, RaidForums"
496,25/07/2017,CopyKittens,"Several countries including Israel, Saudi Arabia, the United States, Germany, Jordan and Turkey","Trend Micro reveals the details of a new massive cyber espionage campaign called ""Operation Wilted Tulip"", carried on by CopyKittens, an Iran-linked cyber espionage group targeting several countries including Israel, Saudi Arabia, the United States, Germany, Jordan and Turkey.",Targeted Attack,Y Multiple targets,CE,>1,http://www.ibtimes.co.uk/copykittens-iran-linked-cyber-espionage-group-lacks-sophistication-still-successful-1632024,"CopyKittens, Trend Micro, Iran, Operation Wilted Tulip"
497,25/07/2017,?,Single Individuals,"Kaspersky Lab analysts detect CowerSnail, a malicious program for Windows apparently created by the same group responsible for SambaCry.",Malware,X Individual,CC,>1,https://securelist.com/cowersnail-from-the-creators-of-sambacry/79087/,"Kaspersky, CowerSnail, SambaCry"
498,25/07/2017,?,"942,609 Yorkshire people","The Yorkshire Post reveals that the personal data of 942,609 Yorkshire people is listed for sale on an underground marketplace.",Account Hijacking,X Individual,CC,UK,http://www.yorkshirepost.co.uk/news/details-of-a-million-people-across-yorkshire-for-sale-on-dark-web-1-8668876,"The Yorkshire Post, Yorkshire"
499,26/07/2017,?,Android Users,Google discovers a new family of spyware called Lipizzan containing references to a cyber arms company called Equus Technologies.,Malware,X Individual,CE,>1,https://android-developers.googleblog.com/2017/07/from-chrysaor-to-lipizzan-blocking-new.html,"Google, Lipizzan, Equus Technologies"
500,26/07/2017,?,UniCredit,"UniCredit SpA, Italy’s No. 1 bank, says that hackers took biographical and loan data from 400,000 client accounts. The attack occurred in September and October of 2016 and June and July of this year.",Unknown (third party breach),K Financial and insurance activities,CC,IT,https://www.bloomberg.com/news/articles/2017-07-26/unicredit-says-400-000-clients-affected-by-security-breach,Unicredit
501,27/07/2017,Russia?,Macron Campaign,Reuters reveals that Russian intelligence agents attempted to spy on President Emmanuel Macron's election campaign earlier this year by creating phony Facebook personas.,Account Hijacking,"O Public administration and defence, compulsory social security",CE,FR,https://www.reuters.com/article/us-cyber-france-facebook-spies-exclusive-idUSKBN1AC0EI,"Russia, Macron, Facebook"
502,27/07/2017,?,Virgin America,Virgin America confirms that a hacker broke into its corporate network earlier this year on March 13.,Unknown,H Transportation and storage,CC,US,http://www.zdnet.com/article/virgin-america-hacked-network-forced-employees-change-passwords/,Virgin America
503,27/07/2017,CobaltGipsy (a group allegedly linked to Iran),Several entities in the Middle East and North Africa with a focus on Saudi Arabian organizations,"Securworks reveal the details of a group, allegedly linked to Iran, dubbed ""Cobalt Gypsy"", reportedly using well-established fake online personas of attractive women to befriend targets, gain their trust and later dupe them into opening malicious software that could provide hackers with ""full access"" to private computer networks.",Targeted Attack,Y Multiple targets,CE,>1,https://www.secureworks.com/research/the-curious-case-of-mia-ash,"CobaltGipsy, Secureworks, Iran"
504,27/07/2017,?,Critical Infrastructures,"The Epoch Times reveals that an underground dark web marketplace, dubbed CMarket, is selling access to the private computer networks of critical infrastructure targets, including power plants, government departments, hospitals, financial firms and airlines in exchange for bitcoin",Unknown,Y Multiple targets,CC,>1,http://www.theepochtimes.com/n3/2272096-hackers-selling-access-to-critical-infrastructure-on-darknet-2/,"The Epoch Times, Cmarket"
505,27/07/2017,?,Unnamed Canadian Organization,"Cytelligence reveals that an undisclosed Canadian organization has reportedly paid criminals $425,000 in bitcoin after its systems were crippled in a ransomware attack.",Malware,Z Unknown,CC,CA,https://www.itgovernanceusa.com/blog/ransomware-canadian-company-pays-425000/,"Cytelligence, Ransomware"
506,28/07/2017,?,CIA,WikiLeaks publishes three new alleged CIA hacking tools as part of its new Vault 7 dump.,Unknown,"O Public administration and defence, compulsory social security",H,US,http://www.ibtimes.co.uk/wikileaks-new-dump-imperial-exposes-3-cia-hacking-tools-targeting-macs-linux-1632359,"CIA, WikiLeaks, Vault7"
507,28/07/2017,?,Plastic Surgery Associates,Plastic Surgery Associates reveals that a data breach may have compromised patient records after it was hit with a ransomware attack earlier this year on 12 February.,Malware,Q Human health and social work activities,CC,US,http://www.ibtimes.co.uk/plastic-surgery-associates-data-breach-patients-records-payment-card-details-possibly-compromised-1632555,"Plastic Surgery Associates, ransomware"
508,28/07/2017,?,Bharat Sanchar Nigam Limited (BSNL) and Mahanagar Telephone Nigam Limited (MTNL),"The author of the BrickerBot malware claims responsibility for a cyber-attack that took place in various Indian states and causes over 60,000 modems and routers to lose Internet connectivity.",Malware,J Information and communication,CC,IN,https://www.bleepingcomputer.com/news/security/brickerbot-dev-claims-cyber-attack-that-affected-over-60-000-indian-modems/,"Bharat Sanchar Nigam Limited, BSNL, Mahanagar Telephone Nigam Limited, MTNL, BrickerBot"
509,28/07/2017,?,Android Users,"Security researchers from Dr.Web find the Triada malware inside the firmware of several low-cost Android smartphones, such as Leagoo M5 Plus, Leagoo M8, Nomu S10, and Nomu S20.",Malware,X Individual,CC,>1,https://www.bleepingcomputer.com/news/security/triada-trojan-found-in-firmware-of-low-cost-android-smartphones/,"Android, Leagoo M5 Plus, Leagoo M8, Nomu S10, Nomu S20, Dr.Web, Triada"
510,28/07/2017,?,WestJet,WestJet says it is working with police in Calgary and the RCMP cybercrime unit after some members' profile data were disclosed online.,Unknown,H Transportation and storage,CC,CA,http://www.cbc.ca/news/canada/calgary/westjet-privacy-breach-rewards-members-1.4227534,WestJet
511,31/07/2017,?,HBO,HBO joins the ranks of Hollywood entertainment companies to suffer a major cyber attack. The company network is compromised and the attacker claim to have stolen 1.5 TB of data. Few days after they leak an episode of the new season of Games of Thrones,Unknown,R Arts entertainment and recreation,CC,US,http://ew.com/tv/2017/07/31/hbo-hacked-game-of-thrones/,"HBO, Games of Thrones"
512,31/07/2017,?,Android Users,Kaspersky Lab reveals the details of a new variant of the Svpeng trojan working as a keylogger and stealing data through the accessibility services.,Malware,X Individual,CC,>1,https://securelist.com/a-new-era-in-mobile-banking-trojans/79198/,"Kaspersky Lab, Svpeng"
513,31/07/2017,?,Mandiant (a FireEye company),A Mandiant threat intelligence analyst is the victim of Operation #LeakTheAnalyst. Attackers infiltrate his computer for more than a year and leak some internal data.,Targeted Attack,J Information and communication,CC,US,https://thenextweb.com/insider/2017/07/31/hackers-kick-off-leaktheanalyst-campaign-by-dumping-data-of-1bn-security-firm/#.tnw_nXwjXiQi,"Mandiant, #LeakTheAnalyst, FireEye"
