ID,Date,Author,Target,Description,Attack,Target Class,Attack Class,Country,Link,Tags
641,14/09/2017,?,Android Users,"Researchers from Check Point find at least 50 apps in the official Google Play market, infected with a malware dubbed ExpensiveWall, that made charges for fee-based services without the knowledge or permission of users. The apps were downloaded as many as 4.2 million times.",Malware,X Individual,CC,>1,https://arstechnica.com/information-technology/2017/09/malicious-apps-with-1-million-downloads-slip-past-google-defenses-twice/,"Check Point, Android, ExpensiveWall"
642,14/09/2017,?,Single Individuals,Researchers from ESET discover a malvertising campaign delivering JavaScript code (a variant of MineCrunch AKA Web Miner) able to mine multiple cryptocurrencies inside the browser.,Malvertising,X Individual,CC,>1,https://www.bleepingcomputer.com/news/security/malvertising-campaign-mines-cryptocurrency-right-in-your-browser/,"ESET, JavaScript, MineCrunch, Web Miner"
643,14/09/2017,?,Users in South Korea,Researchers from Trend Micro spot a new campaign leveraging the Hangul Word Processor (HWP) to target users in South Korea.,Targeted Attack,X Individual,CE,KR,http://blog.trendmicro.com/trendlabs-security-intelligence/hangul-word-processor-postscript-abused-malicious-attachments/,"Trend Micro, Hangul Word Processor, HWP"
644,15/09/2017,?,Unidentified public organisation in Singapore,"According to a report released by the Cyber Security Agency of Singapore (CSA), an unidentified public organisation in Singapore faced a foreign ""state-sponsored"" cyberattack late last year.",Targeted Attack,"O Public administration and defence, compulsory social security",CE,SG,http://www.channelnewsasia.com/news/singapore/singapore-public-organisation-faced-state-sponsored-cyberattack-9218776,Cyber Security Agency of Singapore. CSA
645,15/09/2017,Turla,Swiss Defence Ministry,Switzerland’s defence ministry reveals to have detected a Cyber Attack carried on by the infamous Turla APT.,Targeted Attack,"O Public administration and defence, compulsory social security",CE,CH,http://www.firstpost.com/tech/news-analysis/swiss-defence-ministry-foils-cyber-attack-attempt-by-malware-seen-in-other-global-hacks-4048165.html,"Switzerland Defence Ministry, Turla"
646,15/09/2017,?,Augusta Medical Center,"Nearly five months after it happened, Augusta Medical Center announces that some patients may have had their personal information compromised by an attack on faculty email accounts.",Account Hijacking,Q Human health and social work activities,CC,US,http://chronicle.augusta.com/news/2017-09-15/au-medical-center-patients-data-possibly-compromised-attack-faculty-email-accounts,Augusta Medical Center
647,15/09/2017,?,Morehead Memorial Hospital,Morehead Memorial says that a data breach due to a phishing attack has potentially exposed patient and employee information.,Account Hijacking,Q Human health and social work activities,CC,US,https://www.databreaches.net/nc-morehead-memorial-hospital-data-breach-may-have-leaked-patient-and-employee-information/,Morehead Memorial Hospital
648,12/09/2017,?,Litebit,"Hackers gain access to Litebit’s backend and obtain email addresses, hashed passwords, and IBAN information, among other things. No money is stolen in the process, though.",Unknown,V Fintech,CC,NL,https://themerkle.com/dutch-bitcoin-broker-litebit-suffers-from-second-data-breach-in-six-weeks/,"Litebit, Bitcoin"
649,12/09/2017,?,Single Individuals,Security researchers at Sophos discover a new RAT called Kedi that uses Gmail to steal data from the targeted computer. The malware is disguised as a Citrix utility.,Malware,X Individual,CC,>1,https://nakedsecurity.sophos.com/2017/09/12/beware-the-kedi-rat-pretending-to-be-a-citrix-file-that-gmails-home/,"Sophos, Kedi, Gmail, Citrix"
650,13/09/2017,?,UAE Government,"A trove of leaking emails belonging to the UAE government reveals an alleged plot to ""conquer"" Qatar.",Unknown,"O Public administration and defence, compulsory social security",CC,UAE,http://www.middleeasteye.net/news/saudi-arabia-came-close-conquering-qatar-new-leaked-emails-show-1491607860,"UAE, Qatar"
651,13/09/2017,The Dark Overlord,SMART Physical Therapy,SMART (“Sports Medicine and Rehabilitation Therapy”) Physical Therapy is the n-th victim of The Dark Overlord.,Unknown,Q Human health and social work activities,CC,US,https://www.databreaches.net/ma-smart-physical-therapy-hacked-by-thedarkoverlord/,"SMART Physical Therapy, The Dark Overlord"
652,16/09/2017,?,The Pirate Bay Users,"A cryptocurrency miner appear on The Pirate Bay website, using the computer resources of visitors to mine Monero coins and hence spiking its visitors' CPU.",Cryptocurrency Miner,X Individual,CC,>1,https://torrentfreak.com/the-pirate-bay-website-runs-a-cryptocurrency-miner-170916/,"The Pirate Bay, Monero"
653,18/09/2017,?,Multiple Companies,Cisco Talos publishes a technical analysis of a backdoor which was included with version 5.33 of the CCleaner application. The analysis reveals that the attack was conceived to target multiple companies including Cisco itself.,Malware,Y Multiple targets,CE,>1,http://blog.talosintelligence.com/2017/09/ccleaner-c2-concern.html,"Cisco, Talos, Ccleaner"
654,18/09/2017,The Dark Overlord,Columbia Falls and Flathead County School Districts,The Dark Overlord sends a threatening ransom note to the Columbia Falls (Montana) school district forcing officials to shutter its schools to ensure the safety of the students.,Unknown,P Education,CC,US,https://www.scmagazine.com/the-dark-overlord-cybergang-threatens-kids-in-its-latest-attack/article/690482/,Columbia Falls and Flathead County
655,18/09/2017,?,Multiple Targets,Researchers from Kaspersky reveal the details of a new attack technique leveraging an undocumented Word feature to gather information on users.,Targeted Attack,Y Multiple targets,CC,>1,http://securityaffairs.co/wordpress/63158/hacking/undocumented-word-feature-attack.html,Kaspersky
656,19/09/2017,?,Single Individuals,Researchers from Barracuda Advanced Technology Group spot a new Locky campaign launching around 20 million fresh attacks in just a day.,Malware,X Individual,CC,>1,https://blog.barracuda.com/2017/09/19/barracuda-advanced-technology-group-monitoring-aggressive-ransomware-threat/,"Barracuda Advanced Technology Group, Locky, ransomware"
657,19/09/2017,?,Android Users,"Researchers from SfyLabs reveal the details of Red Alert 2.0, an Android malware targeting over 60 bank and social media apps on Google Play.",Malware,X Individual,CC,>1,http://www.ibtimes.co.uk/red-alert-2-0-new-android-banking-malware-that-steals-credentials-also-being-rented-out-500-1639856,"SfyLabs, Red Alert 2.0, Google Play, Android"
658,19/09/2017,?,The Irish National Teachers Organisation (INTO),"The Irish National Teachers Organisation warns users of its online learning portal that their personal data may have been compromised following the hacking of the website. Around 30,000 users details were potentially compromised by the hack.",Unknown,P Education,CC,IE,https://www.rte.ie/news/2017/0919/905903-into-hacking/,"INTO, Irish National Teachers Organisation"
659,19/09/2017,?,Google Chrome Users,"SafeBrowse, a Chrome browser extension, with over 140,000 users, is found containing a JavaScript Crypto Miner based on Coinhive.",Malware,X Individual,CC,>1,https://hotforsecurity.bitdefender.com/blog/first-ever-crypto-mining-chrome-extension-discovered-18992.html,"SafeBrowse, Google Chrome, JavaScript, Coinhive"
660,20/09/2017,APT 33,Aviation Firms in the US and Saudi Arabia,"FireEye reveals the details of APT33, a group operational since 2013 and focused on the aerospace industry, successfully hacking firms with aviation in the U.S. and Saudi Arabia in the last year. Other targets include Petrochemical firms in South Korea and Saudi Arabia.",Targeted Attack,C Manufacturing,CC,"US
 UAE",https://www.forbes.com/sites/thomasbrewster/2017/09/20/iran-hacker-crew-apt33-heading-for-destructive-cyberattacks/#35e05fb44a48,"FireEye, APT33, Iran"
661,20/09/2017,?,U.S. Securities and Exchange Commission,"The U.S Securities and Exchange Commission reveals that its computer system had been hacked last year, giving the attackers private information that could have been exploited for trading. The breach was discovered in August.",Unknown,"O Public administration and defence, compulsory social security",CC,US,https://www.sec.gov/news/press-release/2017-170,"U.S Securities and Exchange Commission, SEC"
662,21/09/2017,?,Single Individuals,"Researchers at MalwareHunterTeam spot a ransomware, called nRansomware, demanding naked photographies instead of Bitcoins.",Malware,X Individual,CC,>1,https://motherboard.vice.com/en_us/article/yw3w47/this-ransomware-demands-nudes-instead-of-bitcoin,"MalwareHunterTeam, nRansomware, Ransomware"
663,24/09/2017,?,Arkansas Oral & Facial Surgery Center,"Arkansas Oral & Facial Surgery Center disclose a ransomware incident that may or may not have resulted in access to protected health information of as many as 128,000 patients.",Malware,P Education,CC,US,https://www.databreaches.net/arkansas-oral-facial-surgery-center-notifies-128000-patients-of-ransomware-incident/,"Arkansas Oral & Facial Surgery Center, Ransomware"
664,25/09/2017,?,Deloitte,"The Guardian reveals that Deloitte, one of the world’s “big four” accountancy firms has been targeted by a sophisticated hack that compromised the confidential emails and plans of some of its blue-chip clients.",Targeted Attack,M Professional scientific and technical activities,CC,UK,https://www.theguardian.com/business/2017/sep/25/deloitte-hit-by-cyber-attack-revealing-clients-secret-emails,Deloitte
665,25/09/2017,?,Android Users,"Researchers from Trend Micro reveal the details of ZNIU, the first Android malware to exploit the Dirty Cow (CVE-2016-5195) vulnerability. ZNIU has been detected in more than 40 countries, in about 1,200 and has affected so far more than 5,000 users.",Malware,X Individual,CC,>1,http://blog.trendmicro.com/trendlabs-security-intelligence/zniu-first-android-malware-exploit-dirty-cow-vulnerability/,"Trend Micro, ZNIU, Android, Dirty Cow, CVE-2016-5195"
666,25/09/2017,?,"showtime.com
 showtimeanytime.com","Two Showtime domains are found serving Coinhive, a JavaScript library that mines Monero using the CPU resources of users visiting Showtime's websites. It is not clear if the event is the consegue of a hack or an experiment.",Malware,X Individual,CC,US,https://www.bleepingcomputer.com/news/security/showtime-websites-used-to-mine-monero-unclear-if-hack-or-an-experiment/,"showtime.com, Coinhive
 showtimeanytime.com"
667,26/09/2017,?,Sonic Drive-In,"Sonic Drive-In, a fast-food chain with nearly 3,600 locations across 45 U.S. states, acknowledges a breach affecting an unknown number of store payment systems.",PoS Malware,I Accommodation and food service activities,CC,US,https://krebsonsecurity.com/2017/09/breach-at-sonic-drive-in-may-have-impacted-millions-of-credit-debit-cards/,Sonic
668,26/09/2017,?,National Football League (NFL),"Researchers from MacKeeper discover a misconfigured Elasticsearch database containing the details of 1,133 NFL players. Unfortunately the researchers also show evidence that criminals have been able to access the data.",Misconfigured database,R Arts entertainment and recreation,CC,US,https://mackeepersecurity.com/post/nfl-players-association-exposed-personal-data,"MacKeeper, NFL, National Football League"
669,26/09/2017,The Dark Overlord,Auburn Eye Care Associates,"TheDarkOverlord reveal another hack involving patient data. This time the victim is Auburn Eye Care Associates, despite the original hack dates back in June.",Unknown,Q Human health and social work activities,CC,US,https://www.databreaches.net/auburn-eye-care-associates-can-you-see-it-now/,"Auburn Eye Care Associates, The Dark Overlord"
670,27/09/2017,Aslan Neferler Tim,Danish Ministries of Immigration and Foreign Affairs,"The Ministry of Immigration and the Ministry of Foreign Affairs of Denmark, are hit by a DDoS attack thought to have come from a Turkish hacker group dubbed Aslan Neferler Tim.",DDoS,"O Public administration and defence, compulsory social security",H,DK,https://www.thelocal.dk/20170928/two-danish-ministries-taken-offline-by-cyber-attack,"Aslan Neferler Tim, Danish Ministry of Immigration, Danish Ministry of Foreign Affairs"
671,28/09/2017,?,Whole Foods Market,"Whole Foods Market says payment card information has been stolen from taprooms, restaurants and other venues located within some of its stores.",PoS Malware,G Wholesale and retail trade,CC,US,https://www.reuters.com/article/us-amazon-com-cyber/whole-foods-says-taprooms-restaurants-hacked-idUSKCN1C33DF,Whole Foods Market
672,28/09/2017,?,Unpatched IIS 6.0 servers,"ESET reveals that a malware author (or authors) has made around $63,000 during the past five months by hacking unpatched IIS 6.0 servers and mining Monero using CVE-2017-7269.",Vulnerability,X Individual,CC,>1,https://www.welivesecurity.com/2017/09/28/monero-money-mining-malware/,"ESET, Monero, CVE-2017-7269."
673,28/09/2017,?,"Free Press
 Fight For the Future","The Electronic Frontier Foundation (EFF) reveals the details of “Phish For The Future,” an advanced persistent spearphishing campaign targeting digital civil liberties activists at Free Press and Fight For the Future discovered between July 7th and August 8th of 2017.",Targeted Attack,J Information and communication,CE,N/A,https://www.eff.org/deeplinks/2017/09/phish-future,"Electronic Frontier Foundation, EFF, Phish For The Future, Free Press, Fight For the Future"
674,28/09/2017,?,Single Individuals,"Researchers from Malwarebytes spot a campaign abusing native ad and content provider Taboola to serve malvertising,",Malvertising,X Individual,CC,>1,https://blog.malwarebytes.com/threat-analysis/2017/09/tech-support-scammers-abuse-native-ad-content-provider-taboola-serve-malvertising/,"Malwarebytes, Taboola"
675,28/09/2017,?,San Ysidro School District,"Malware infect of the San Ysidro School District, deleting emails and forcing the district to temporarily shut down part of its systems.",Malware,P Education,CC,US,https://www.databreaches.net/malware-attacks-san-ysidro-school-district-demands-19k-ransom/,"San Ysidro School District, Ransomware"
676,28/09/2017,?,Toms River Police Department,"The township of Toms River plans to notify about 3,700 people that their personal information may have been compromised by a data breach inside the police department over the summer.",Unknown,"O Public administration and defence, compulsory social security",CC,US,https://www.databreaches.net/data-breach-at-toms-river-police-headquarters/,Toms River Police Department
677,29/09/2017,?,Saudi Arabia’s General Entertainment Authority (GEA),"Saudi Arabia’s General Entertainment Authority (GEA), says that its website had been the target of cyber attacks from outside the kingdom.",DDoS,"O Public administration and defence, compulsory social security",CC,AE,https://www.reuters.com/article/us-saudi-cyber-attack/saudi-entertainment-authority-says-hit-by-cyber-attack-idUSKCN1C427R,"Saudi Arabia’s General Entertainment Authority, GEA"
678,29/09/2017,?,IRINN (Indian Registry for Internet Names and Numbers),"Researchers from Seqrite’s Cyber Intelligence Labs discover 6000 login credentials up for sale on DarkNet, belonging to Indian ISPs, government departments and private businesses. The researchers identify the origin of the breach from the IRINN.",Unknown,J Information and communication,CC,IN,http://www.ibtimes.co.uk/login-credentials-over-6000-indian-government-departments-businesses-put-sale-darknet-1641768,"Seqrite’s Cyber Intelligence Labs, DarkNet, IRINN, Indian Registry for Internet Names and Numbers"
679,29/09/2017,?,Wordpress Users,"A cyber-criminal hides the code for a PHP backdoor inside the source code of a WordPress plugin masquerading as a security tool named ""X-WP-SPAM-SHIELD-PRO"" The attacker tried to leverage the reputation of a legitimate and highly popular WordPress plugin called ""WP-SpamShield Anti-Spam"".",PHP Backdoor,X Individual,CC,>1,https://www.bleepingcomputer.com/news/security/hacker-hides-backdoor-inside-fake-wordpress-security-plugin/,"WordPress, WP-SpamShield Anti-Spam, X-WP-SPAM-SHIELD-PRO"
680,30/09/2017,?,Gianfranco Dell'Alba,"The director of the General Confederation of Italian Industry group in Brussels falls victim of an email scam and transfers 500,000 EUR (590,000 USD) to an unknown bank account.",Account Hijacking,X Individual,CC,IT,http://www.repubblica.it/cronaca/2017/09/30/news/beffa_a_bruxelles_mister_confindustria_truffato_e_licenziato-176906111/,"General Confederation of Italian Industry, Gianfranco Dell'Alba"
681,30/09/2017,?,national-lottery.co.uk,"Camelot reveals that a DDOS attack took down the website of the National Lottery,",DDoS,R Arts entertainment and recreation,CC,UK,http://www.mirror.co.uk/news/uk-news/national-lottery-website-brought-down-11267701,"Camelot Group, National Lottery, national-lottery.co.uk"
682,30/09/2017,?,R6DB,"R6DB, a fan-powered online gaming service that provides statistics for players of Ubisoft's tactical FPS Rainbow Six Siege, is hit by hackers, who wipe its databases and hold the data for ransom.",Malicious Bot,R Arts entertainment and recreation,CC,US,https://medium.com/@r6db/so-we-got-hacked-b6631ed2e1ec,R6DB
683,01/10/2017,?,Etherparty.io,"Hackers disrupt the Etherparty ICO (Initial Coin Offering) after hijacking the platform's website, displaying their own Ethereum address, tricking 59 ICO participants into sending funds to the wrong wallets.",Unknown,V Fintech,CC,US,https://www.bleepingcomputer.com/news/security/hackers-hijack-another-ethereum-ico-small-number-of-users-affected/,Etherparty.io
684,01/10/2017,?,OKEx,"After victims reported losing a collective of over 600 Bitcoin, worth around 20 million Chinese yuan, at the time of the thefts, or around 3 million USD, OKEx, a Bitcoin exchange based in China, issues a statement, denying it was hacked earlier in August, and blaming recent thefts on careless users who didn't secure their accounts.",Account Hijacking,V Fintech,CC,CN,https://www.bleepingcomputer.com/news/security/bitcoin-exchange-denies-getting-hacked-after-customers-lose-3-million/,OKEx
685,04/10/2017,?,"4,000 NATO Soldiers","The Wall Street Journal reports that Russian hackers have so far accessed the phones of 4,000 NATO troops in Europe",Unknown,"O Public administration and defence, compulsory social security",CE,INT,https://www.wsj.com/articles/russia-targets-soldier-smartphones-western-officials-say-1507109402,"NATO, Russia"
686,05/10/2017,Russia?,National Security Agency,The Wall Street Journal reveals that hackers working for the Russian government stole details of how the U.S. penetrates foreign computer networks and defends against cyberattacks after a National Security Agency contractor removed the highly classified material and put it on his home computer. It appears that a backdoor in the Kaspersky Antivirus software played a role in the attack.,Targeted Attack,"O Public administration and defence, compulsory social security",CE,US,,"Kaspersky, NSA"
687,05/10/2017,?,"Aerospace, Defense Contractor, and Manufacturing sectors within the U.S. and South Korea","Researchers from FireEye reveal to have observed several high-volume FormBook malware distribution campaigns primarily taking aim at Aerospace, Defense Contractor, and Manufacturing sectors within the U.S. and South Korea",Targeted Attack,Y Multiple Targets,CE,US,https://www.fireeye.com/blog/threat-research/2017/10/formbook-malware-distribution-campaigns.html,"FireEye, FormBook"
688,05/10/2017,?,"Aerospace, Defense Contractor, and Manufacturing sectors within the U.S. and South Korea","Researchers from FireEye reveal to have observed several high-volume FormBook malware distribution campaigns primarily taking aim at Aerospace, Defense Contractor, and Manufacturing sectors within the U.S. and South Korea",Targeted Attack,Y Multiple Targets,CE,KR,https://www.fireeye.com/blog/threat-research/2017/10/formbook-malware-distribution-campaigns.html,"FireEye, FormBook"
689,05/10/2017,?,Movimento 5 Stelle,"A new attack takes down Rousseau, the online voting platform used by the Italian Movimento 5 Stelle. Some internal screenshots are also posted online.",DDoS,N Administrative and support service activities,CC,IT,https://www.reuters.com/article/us-italy-politics-5star/hacking-attacks-a-pre-election-setback-for-italys-5-star-movement-idUSKBN1CA1TM,"Movimento 5 Stelle, Rousseau"
690,05/10/2017,?,John Kelly's personal cellphone,"White House officials believe that chief of staff John Kelly’s personal cellphone was compromised, potentially as long ago as December, according to three U.S. government officials.",Account Hijacking,X Individual,CE,US,https://www.politico.com/story/2017/10/05/john-kelly-cell-phone-compromised-243514,John Kelly
691,06/10/2017,?,"A bank based in Middle East, a trademark and intellectual property service companies based in Europe, an international sporting organization, and individuals with indirect ties to a country in North East Asia.","Researchers from Palo Alto Networks reveal the details of Operation FreeMilk, a campaign targeting a bank based in the Middle East, a trademark and intellectual property service company based in Europe, an international sporting organization, and even lone individuals with indirect ties to a country in North East Asia.",Targeted Attack,Y Multiple targets,CE,>1,https://researchcenter.paloaltonetworks.com/2017/10/unit42-freemilk-highly-targeted-spear-phishing-campaign/,"Palo Alto Networks, Operation FreeMilk"
692,06/10/2017,?,Disqus,"Disqus confirms a data breach that appears to have taken place in the summer of 2012, and during which an unknown attacker(s) made off with details for at least 17.5 million user accounts.",Unknown,J Information and communication,CC,US,https://www.bleepingcomputer.com/news/security/disqus-confirms-2012-data-breach-that-exposed-details-for-17-5-million-users/,Disqus
693,06/10/2017,?,Forrester Research,"Forrester, one of the world's leading market research and investment advisory firms, admits that a security breach took place during the past week. An unidentified attacker (or attackers) has gained access to the infrastructure hosting its website stealing valid credentials.",Unknown,M Professional scientific and technical activities,CC,US,https://www.bleepingcomputer.com/news/security/market-research-firm-forrester-says-hackers-stole-sensitive-reports/,Forrester
694,06/10/2017,KovCoreG group,PornHub users,"Proofpoint researchers detect a large-scale malvertising attack by the so-called KovCoreG group, targeting PornHub users.",Malvertising,X Individual,CC,>1,https://www.proofpoint.com/us/threat-insight/post/kovter-group-malvertising-campaign-exposes-millions-potential-ad-fraud-malware,"KovCoreG group, Proofpoint"
695,06/10/2017,?,Office 365 Accounts,"Researchers from Skyhigh Networks discover a new attack with a stealthy technique, dubbed KnockKnock, that targets Office 365 accounts.",Account Hijacking,X Individual,CC,>1,http://securityaffairs.co/wordpress/63969/hacking/knockknock-attacks-0365.html,1
696,08/10/2017,FIN7,Multiple Targets,Researchers from security company Iceberg reveal the details of a new campaign carried on by the financial motivated threat actor FIN7 (AKA Carbanak) exploiting new evasion techniques.,Targeted Attack,K Financial and insurance activities,CC,>1,http://www.zdnet.com/article/carbanak-threat-group-change-plan-of-attack/,"Iceberg. FIN7, Carbanak"
697,09/10/2017,?,Taiwanese Bank,A hacking gang abuses the SWIFT banking network to steal $60 million after planting malware on a Taiwanese bank’s servers. Two arrests are made in Sri Lanka related to the attack.,Malware,K Financial and insurance activities,CC,TW,https://www.tripwire.com/state-of-security/security-data-protection/hackers-steal-60-million-from-taiwanese-bank-using-bespoke-malware/,SWIFT
698,09/10/2017,OilRig,Unnamed UAE Government Organization,Researchers from Palo Alto Networks spot a new campaign launched by the notorious APT group OilRig against an organization within the government of the United Arab Emirates (UAE).,Targeted Attack,"O Public administration and defence, compulsory social security",CE,UAE,http://securityaffairs.co/wordpress/64119/apt/oilrig-isminjector-campaign.html,"OilRig, Palo Alto Networks"
699,10/10/2017,?,South Korea-US Operational Plan,"Korean News Agency Yonhap News reveals that North Korean hackers are believed to have stolen Operational Plan 5015 a large amount of classified military documents (235 GB), including the latest South Korea-U.S. wartime operational plan, last year.",Targeted Attack,"O Public administration and defence, compulsory social security",CE,"US
 KR",http://english.yonhapnews.co.kr/news/2017/10/10/0200000000AEN20171010003052315.html?sns=tw,"Yonhap News, Operational Plan 5015, North Korea"
700,10/10/2017,North Korea,U.S. Electric Power Companies,FireEye says in a new report to private clients that hackers linked to North Korea recently targeted U.S. electric power companies with spearphishing emails.,Targeted Attack,D Electricity gas steam and air conditioning supply,CC,US,https://www.nbcnews.com/news/north-korea/experts-north-korea-targeted-u-s-electric-power-companies-n808996,"FireEye, North Korea"
701,10/10/2017,?,Several targets in the financial sector,Security researchers at Kaspersky Lab reveal the details of a new malware strain called ATMii because it attacks ATMs that run on Windows 7 and Windows Vista.,Malware,K Financial and insurance activities,CC,>1,https://securelist.com/atmii-a-small-but-effective-atm-robber/82707/,"Kaspersky Lab, ATMii"
