ID,Date,Author,Target,Description,Attack,Target Class,Attack Class,Country,Link,Tags
1,01/01/2017,>1,Several Institutions in the British Government,"The British National Cyber Security Centre reveals to have foiled 86 attacks in its first month of activity most of which are suspected to have come from China, North Korea, Russia, Iran and criminal gangs. Top targets include the Bank of England , the Ministry of Defence , nuclear bases, security services and infrastructure such as transport, the NHS and power systems.",>1,"O Public administration and defence, compulsory social security",CE,GB,http://www.mirror.co.uk/news/uk-news/brit-cyber-warriors-fight-two-9548368,"Great Britain, China, North Korea, Russia, Iran, Bank of England, Ministry of Defence, NHS"
2,01/01/2017,?,Transmission and electricity producing lines,Sources from the Energy Ministry claim that a major cyber-attack is the source of the widespread electricity cuts across Istanbul. Turkey sources blame the US for the Attack,Unknown,D Electricity gas steam and air conditioning supply,CW?,TR,http://www.hurriyetdailynews.com/major-cyber-attack-on-turkish-energy-ministry-reported.aspx?pageID=238&nID=107981&NewsCatID=348,Turkey
3,01/01/2017,CyberZeist,fbi.gov,"Exploiting a vulnerability of Plone CMS, CyberZeist claim to have hacked fbi.gov and leaks the records of 155 FBI officials on pastebin. Plone denies that a 0-day vulnerability has been exploited to carry on the attack.",Plone CMS vulnerability,"O Public administration and defence, compulsory social security",CC,US,http://securityaffairs.co/wordpress/55042/data-breach/fbi-hacked.html,"CyberZeist, fbi.gov"
4,01/01/2017,?,Susan M. Hughes Center (hughescenter.net),"The Susan M. Hughes Center notifies a ransomware incident affecting 11,400 patients.",Malware,Q Human health and social work activities,CC,US,https://www.databreaches.net/cosmetic-surgery-center-discloses-ransomware-attack/,"Susan M. Hughes Center, hughescenter.net"
5,03/01/2017,Anonymous,humanrightscommission.vic.gov.au,A group claiming to be part of the Anonymous collective defaces Victoria’s Human Rights Commission website (humanrightscommission.vic.gov.au) with a nonsensical message about its social network AnonPlus.,Defacement,"O Public administration and defence, compulsory social security",H,GB,https://www.theguardian.com/technology/2017/jan/03/anonymous-hackers-take-over-victorias-human-rights-commission-website,"humanrightscommission.vic.gov.au, Anonymous"
6,04/01/2017,?,India National Defence Academy (NDA) and National Investigation Agency (NIA),Indian security forces have been alerted by central intelligence agencies that a WhatsApp virus is threatening to hack into their personal information and banking data.,Malware,"O Public administration and defence, compulsory social security",CE,IN,http://mashable.com/2017/01/04/india-security-forces-whatsapp-virus-alert/#qc.ulsMXCPq9,"NDA, NIA, Whatsapp"
7,04/01/2017,Kuroi’SH,google.com.br,Kuroi’SH hjacks the DNS record of google.com.br and redirects the users to a defaced page. The hacks happens compromising the records held by registro.br.,DNS Hijacking,J Information and communication,CC,BR,https://www.techworm.net/2017/01/google-brazil-hacked.html,"Kuroi’SH, google.com.br, registro.br"
8,04/01/2017,?,Emory Brain Health Center,"Emory Healthcare is one of the victims of the MongoDB ransomware attacks and has its database, managed by a third-party and containing 90,000 records encrypted.",Malware,Q Human health and social work activities,CC,US,https://www.databreaches.net/emory-healthcare-patient-data-hijacked-and-held-for-ransom/,"Emory Brain Health Center MongoDB, Ransomware"
9,04/01/2017,?,Northside Independent School District,"The Northside Independent School District sends letters to about 23,000 former and current students and employees regarding a security breach that might have put their personal information at risk after several employees' email accounts have been compromised.",Account Hijacking,P Education,CC,US,https://www.databreaches.net/tx-letter-notifies-23000-nisd-employees-students-of-email-breach/,Northside Independent School District
10,05/01/2017,DragonOK APT,Several Entities in Japan,"Palo Alto reveals the details of DragonOK APT, an operation carried on by a Chinese malicious actor targeting primarily Japan, and other regions such as Taiwan, Tibet, and Russia",Targeted Attack,Y Multiple targets,CE,>1,http://securityaffairs.co/wordpress/55113/apt/china-linked-dragonok.html,"DragonOK APT, Palo Alto Networks"
11,05/01/2017,OilRig APT,Several entities in Israel,"ClearSky Security discovers a new campaign conducted by the Iranian OilRig APT leveraging digitally signed malware and fake University of Oxford domains. The campaign targets at least five Israeli IT vendors, several financial institutes, and the Israeli Post Office.",Targeted Attack,Y Multiple targets,CE,IL,http://securityaffairs.co/wordpress/55145/apt/oilrig-apt-itan.html,"OilRig APT, ClearSky Security, Iran, Oxford"
12,05/01/2017,?,University of Alberta,"The Universtity of Alberta discloses the details of a malware attack, occurred late last year, involving 300 computers and putting over 3,000 students at risk.",Malware,P Education,CC,CA,https://www.databreaches.net/ca-thousands-of-university-of-alberta-students-faculty-put-at-risk-in-malware-security-breach/,University of Alberta
13,06/01/2017,Cyberwolfgang,Square Enix's European Twitter Account (@SQUARE_ENIX_EU),"Video game giant Square Enix's European Twitter account is hacked by a group of hackers calling themselves the ""cyberwolfgang"" and posts multiple tweets mocking other companies including rival gaming company EA, media outlet TechCrunch .",Account Hijacking,R Arts entertainment and recreation,CC,JP,http://www.ibtimes.co.uk/square-enix-europes-twitter-account-hacked-fires-nasty-insults-ea-fifa-1599832,"Square Enix, @SQUARE_ENIX_EU, Twitter, EA"
14,06/01/2017,?,Arizona Department of Administration,Arizona officials investigate how and when several computers used by state legislators and their staffs became infected with malware.,Malware,"O Public administration and defence, compulsory social security",CC,US,https://www.scmagazine.com/malware-found-on-some-arizona-government-computers/article/631045/,Arizona Department of Administration
15,06/01/2017,?,123-Reg,123-Reg is the target of a DDoS attack which disrupted the company's services only days into 2017.,DDoS,J Information and communication,CC,GB,http://www.zdnet.com/article/123-reg-once-again-the-target-of-severe-ddos-attack/,123-Reg
16,06/01/2017,Kapustkiy,esguarnacpuntademata.mil.ve,"One of the websites belonging to Venezuela’s ministry of defense (esguarnacpuntademata.mil.ve) is hacked by Kapustkiy in protest of what the attacker described as the dictatorship of President Nicolas Maduro in the country. The attacker leaks 2,100 records.",SQLi,"O Public administration and defence, compulsory social security",H,VE,http://news.softpedia.com/news/venezuela-army-site-allegedly-hacked-in-protest-against-president-nicolas-maduro-511644.shtml,"Kapustkiy, esguarnacpuntademata.mil.ve, Nicolas Maduro"
17,07/01/2017,?,MJ Freeway,"MJ Freeway, a Denver company whose tracking software is used by hundreds of marijuana companies to comply with state regulations, says its main servers and backup system are down after a ""targeted cyber attack"".",Targeted Attack,J Information and communication,CC,US,http://news.softpedia.com/news/hackers-target-marijuana-shops-with-attacks-against-critical-software-511777.shtml,MJ Freeway
18,07/01/2017,?,Princeton University,"Princeton University is one of the 27,000 victims that have their data wiped by attackers leveraging a vulnerable MongoDB.",Malware,P Education,CC,US,https://www.databreaches.net/princeton-university-becomes-victim-of-mongodb-ransom-attacks/,"Princeton University, MongoDB, Ransomware"
19,08/01/2017,?,esea.net,"Over 1.5 million user profiles featuring names, email addresses and personal IDs from the eSports Entertainment Association (Esea), a leading competitive videogame community, are leaked online after being hijacked by hackers in late December last year.",Unknown,R Arts entertainment and recreation,CC,US,http://www.ibtimes.co.uk/millions-esports-player-data-stolen-by-hackers-leaked-online-1600050,esea.net
20,09/01/2017,?,Netflix Users in the US,FireEye Labs discovers a sophisticated phishing campaign in the wild targeting the credit card data and other personal information of Netflix users primarily based in the United States.,Account Hijacking,X Individual,CC,US,https://www.fireeye.com/blog/threat-research/2017/01/credit_card_dataand.html,"Netflix, FireEye Labs"
21,09/01/2017,?,http://forumserver.twoplustwo.com,"The operators of the world’s largest online poker discussion forum, TwoPlusTwo, confirm that the forum was hacked at some point late in 2016, with the personal data then being offered for sale.",Unknown,R Arts entertainment and recreation,CC,US,https://www.databreaches.net/twoplustwo-poker-forum-hacked-personal-data-stolen-and-offered-for-sale/,"forumserver.twoplustwo.com, TwoplusTwo"
22,10/01/2017,?,The Los Angeles Valley College (LAVC),"The Los Angeles Valley College (LAVC) is forced to pay $28,000 in bitcoin after cybercriminals successfully infected its computer networks, email systems and voicemail lines with ransomware.",Malware,P Education,CC,US,http://www.ibtimes.co.uk/la-school-pays-hackers-28000-bitcoin-after-computer-systems-hit-ransomware-1600304,"The Los Angeles Valley College, LAVC, ransomware"
23,10/01/2017,Anonymous,Multipe Thai Governmantal job portals,"The Anonymous kick off another run of #OpSingleGateway and take down multiple governmental job portals, leaking personal and sensitive details of officials and job seekers.",Unknown,"O Public administration and defence, compulsory social security",H,TH,https://www.hackread.com/anonymous-hacks-thai-govt-job-portal/,"Anonymous, OpSingleGateway"
24,11/01/2017,Giulio Occhionero and Francesca Maria Occhionero,"leading Italian politicians, businessmen and Masons","Italian siblings Giulio and Francesca Maria Occhionero are arrested in Rome, charged with conducting a long-running cyber espionage campaign against leading Italian politicians, businessmen and Masons using a variant of the malware family EyePyramid",Targeted Attack,X Individual,CE,IT,http://www.securityweek.com/italian-siblings-arrested-over-long-running-cyber-espionage-campaign,"Giulio Occhionero, Francesca Maria Occhionero, EyePyramid"
25,11/01/2017,?,Jabbim,The Jabbim Instant Messaging service is hacked and the database (8gb) is dumped in the dark web.,Unknown,J Information and communication,CC,CZ,http://motherboard.vice.com/en_uk/read/hack-exposes-reams-of-private-jabber-chats,Jabbim
26,11/01/2017,The Dark Ovelord?,littlereddooreci.org,"The Dark Overlord hacks the computers of an Indiana-based cancer agency and asks for a large payment of 50 Bitcoin ($44,800) not to release the data. Intially the attack seemed to have been caused by ransomware.",Malware,Q Human health and social work activities,CC,US,https://www.databreaches.net/in-little-red-door-cancer-agency-hit-by-ransomware-attack-by-thedarkoverlord/,"littlereddooreci.org, The Dark Overlord"
27,11/01/2017,?,Kanawha County Schools,Kanawha County Schools tells that their internal documents have been restored after a ransomware attack.,Malware,P Education,CC,US,https://www.databreaches.net/wv-internal-documents-restored-after-ransomware-hack-on-school-district/,Kanawha County Schools
28,12/01/2017,?,Cellebrite,"Motherboard obtains 900 GB of data related to Cellebrite, one of the most popular companies in the mobile phone hacking industry. The cache includes customer information, databases, and a vast amount of technical data regarding Cellebrite's products.",Unknown,J Information and communication,CC,IL,https://motherboard.vice.com/read/hacker-steals-900-gb-of-cellebrite-data,"Cellebrite, Motherboard"
29,12/01/2017,?,General Motors,Reports emerge claiming that GM employees’ names and social security numbers might have been exposed during a breach.,Unknown,C Manufacturing,CC,US,http://news.softpedia.com/news/detroit-car-makers-allegedly-hacked-names-and-social-security-numbers-stolen-511809.shtml,General Motors
30,13/01/2017,Anonymous,Multipe Thai Governmantal job portals,"The Anonymous kick off another run of #OpSingleGateway and take down multiple governmental job portals, leaking personal and sensitive details of officials and job seekers.",Unknown,"O Public administration and defence, compulsory social security",H,TH,https://www.hackread.com/anonymous-hacks-thai-govt-job-portal/,"Anonymous, OpSingleGateway"
31,13/01/2017,?,"Barts health trust, which runs five hospitals in east London: the Royal London, St Bartholomew’s, Whipps Cross, Mile End and Newham","The largest NHS trust in England is hit by rmalware. Unlike early reports suggest, ransomware is ruled out as the cause of the outage.",Malware,Q Human health and social work activities,CC,GB,https://www.infosecurity-magazine.com/news/cyber-attack-barts-health-systems/,"Barts Health Trust, the Royal London, St Bartholomew’s, Whipps Cross, Mile End, Newham, NHS"
32,13/01/2017,Anonymous,Multipe Thai Governmantal job portals,"The Anonymous kick off another run of #OpSingleGateway and take down multiple governmental job portals, leaking personal and sensitive details of officials and job seekers.",Unknown,"O Public administration and defence, compulsory social security",H,TH,https://www.hackread.com/anonymous-hacks-thai-govt-job-portal/,"Anonymous, OpSingleGateway"
33,13/01/2017,?,University of Maryland School of Medicine,A doctor’s practice plan affiliated with the University of Maryland School of Medicine notifies patients that somebody hacked the account of a physician assistant’s email account that contained the personal information of patients. 1500 patients are affected.,Unknown,Q Human health and social work activities,CC,US,https://www.databreaches.net/email-account-with-patient-information-at-um-doctors-group-hacked/,University of Maryland School of Medicine
34,14/01/2017,Kapustkiy,gdc.gob.ve,"In a form of protest against President Nicolas Maduro, Kapustkiy hacks a website of a local government and dumps around 900 records on pastebin.",LFI/SQLi,"O Public administration and defence, compulsory social security",H,VE,http://securityaffairs.co/wordpress/55312/hacking/kapustkiy-hacked-government-of-venezuela.html,"Kapustkiy, gdc.gob.ve, Nicolas Maduro"
35,14/01/2017,?,MrExcel.com,"MrExcel.com reveals that its forum has been compromised on the morning of December 6, 2016.",vBulletin Vulnerability,J Information and communication,CC,US,https://www.databreaches.net/details-of-data-breach-at-mrexcel-com/,MrExcel.com
36,14/01/2017,?,Dracut Public Schools,"Current and former employees’ personal information, including SSN, is acquired by a hacker after an employee falls for what the district describes as a “sophisticated phishing scheme.”",Account Hijacking,P Education,CC,US,https://www.databreaches.net/ma-dracut-schools-employee-data-hacked-after-employee-falls-for-phishing-attempt/,Dracut Public Schools
37,15/01/2017,?,Several Indian Banks,Several Indian Banks discover that their SWIFT systems have been compromised to create fake documents.,Unknown,K Financial and insurance activities,CC,IN,http://tech.economictimes.indiatimes.com/news/technology/hackers-infiltrate-govt-owned-bank-systems-to-create-fake-trade-docs/56583688,SWIFT
38,13/01/2017,Indonesian Hackers,Legitimate Websites,Researchers from Sucuri discover two connected advertising fraud campaigns that compromise legitimate web sites and abuse Google AdSense.,Clickjacking via Malicious Javascript,X Individual,CC,>1,https://www.scmagazine.com/pair-of-ad-fraud-campaigns-linked-to-defacement-attacks-by-indonesian-hackers/article/631351/,Adsense
39,15/01/2017,?,IHOP (International House of Pancakes),IHOPTwitter account (@IHOP) is hacked and posts a political tweet against Hillary Clinton.,Account Hjiacking,I Accommodation and food service activities,CC,US,http://www.nbclosangeles.com/news/local/IHOP-Hacked-Twitter-Political-Tweet-Hillary-Clinton-Sunday-410775535.html,"IHOP, @IHOP, International House of Pancakes, Hillary Clinton"
40,16/01/2017,?,Sentara Healthcare,"A cyber security breach at a third party vendor for Sentara Healthcare compromises the records of over 5,000 patients.",Unknown,Q Human health and social work activities,CC,US,http://wavy.com/2017/01/16/sentara-healthcare-security-breach/,Sentara Healthcare
41,16/01/2017,?,Channel One,Russian state television Channel One blames hackers for the leak online of the final episode of the BBC drama Sherlock a day before its actual planning.,Unknown,J Information and communication,CC,RU,http://securityaffairs.co/wordpress/55386/hacking/sherlock.html,"Channel One, Sherlock Holmes"
42,16/01/2017,?,Laptop belonging to the special investigation team probing President Park Geun-hye’s political scandal.,The Korea Times reveals the details of an attempt made by oversea attackers to hack into a laptop belonging to the special investigation team probing President Park Geun-hye’s political scandal.,Targeted Attack,"O Public administration and defence, compulsory social security",CE,KR,http://m.koreatimes.co.kr/pad/news/view.jsp?req_newsidx=222181,Park Geun-hye
43,17/01/2017,?,Supercell,Supercell Forum is hacked and 1.1 million accounts are leaked. The breach allegedly took place in September 2016.,Unknown,R Arts entertainment and recreation,CC,FI,https://motherboard.vice.com/en_us/article/hackers-steal-Forum-accounts-from-clash-of-clans-creator-supercell,Supercell
44,17/01/2017,?,"20,000 individuals in the Netherlands","Police in the Netherlands are set to email 20,000 possible fraud victims urging them to change their account details, after discovering their credentials had been stolen by a man arrested last year on suspicion of multiple cybercrime offences.",Malware/Account Hijacking,X Individual,CC,NL,https://www.infosecurity-magazine.com/news/dutch-cops-warn-20000-email/,
45,17/01/2017,?,Racingpulse.in,A popular horse racing website (Racingpulse.in) is hacked with Ransomware.,Malware,R Arts entertainment and recreation,CC,IN,https://www.hackread.com/india-horse-racing-site-hacked-with-dharma-ransomware/,"Racingpulse.in, ransomware, Dharma"
46,17/01/2017,?,Advanced Flexible Composites Inc.,The computer system of Advanced Flexible Composites Inc. is hacked preventing the firm from processing quote requests or orders and from receiving emails.,Malware,C Manufacturing,CC,US,https://www.databreaches.net/computer-hacker-hits-illinois-processor/,Advanced Flexible Composites Inc.
47,18/01/2017,?,College students across the United States,The FBI’s Internet Crime Complaint Center publishes an alert against a scam tricking college students into depositing fraudulent checks into their bank accounts.,Account Hjiacking,P Education,CC,US,https://www.ic3.gov/media/2017/170118.aspx,FBI’s Internet Crime Complaint Center
48,18/01/2017,?,Several biomedical research facilities,"Malwarebytes reveals the details of a newly discovered Mac malware, which has likely been targeting biomedical research facilities for at least two years without detection.",Malware,M Professional scientific and technical activities,CC,US,https://blog.malwarebytes.com/threat-analysis/2017/01/new-mac-backdoor-using-antiquated-code/,Malwarebytes
49,18/01/2017,?,POPEYES,"CCC Restaurant Enterprises, LLC, doing business as POPEYES, announce that a recent data security incident may have compromised the security of payment information of some customers who used debit or credit cards at 10 Restaurant locations between May 5, 2016 and August 18, 2016.",PoS Malware,I Accommodation and food service activities,CC,US,https://www.databreaches.net/popeyes-discloses-payment-card-breach-that-began-in-may-2016-10-locations-affected/,POPEYES
50,20/01/2017,?,WCHQ 100.9 FM,"Crescent Hill Radio WCHQ 100.9 FM, a popular, non-profit radio station in Louisville, Kentucky is hacked to play an anti-Trump song for almost 15 minutes by interrupting regular programming.",Unknown,J Information and communication,CC,US,http://www.ibtimes.co.uk/radio-station-kentucky-hacked-fk-donald-trump-song-played-15-minutes-1602495,"Crescent Hill Radio WCHQ 100.9 FM, Donald Trump"
51,20/01/2017,?,St Louis Public Library,"St Louis Public Library is hit by a ransomware attack. Hattackers demand $35,000 worth in Bitcoin.",Malware,Q Human health and social work activities,CC,US,http://www.welivesecurity.com/2017/01/20/ransomware-attack-hits-st-louis-public-library/,"St Louis Public Library, Ransomware"
52,20/01/2017,?,Bowlmor AMF,"Bowlmor AMF, the world’s largest bowling center operator, says that it had a possible data breach at 21 of its more than 300 domestic locations in 12 states between Feb. 4 and March 19.",PoS Malware,R Arts entertainment and recreation,CC,US,https://www.databreaches.net/payment-card-data-snatching-malware-found-on-21-bowlmor-amf-bowling-centers-computers/,Bowlmor AMF
53,20/01/2017,?,Ohio State Veterinary Medical Center,"A malware infection is to blame for a security breach that could put the personal information of up to 4,611 clients of the Ohio State Veterinary Medical Center.",Malware,P Education,CC,US,https://www.databreaches.net/ohio-state-veterinary-medical-center-at-dublin-hit-with-possible-data-breach/,Ohio State Veterinary Medical Center
54,21/01/2017,?,BBC Northampton Twitter account (@BBCNorthampton),The BBC Northampton Twitter account (@BBCNorthampton) is hacked and reports the false news that Donald Trump had been shot.,Account Hjiacking,J Information and communication,CC,GB,http://www.bbc.com/news/uk-england-northamptonshire-38704470,"BBC Northampton, Twitter, @BBCNorthampton, Donald Trump"
55,21/01/2017,Sc0rp10nGh0s7,www.nari-icmr.res.in,Sc0rp10nGh0s7 from the Shad0w Security crew breaks into the servers of the National Aids Research Institute NARI (India) and claims to have accessed a more than 1 GB archive containing the results for dozens Hiv test.,SQLi?,Q Human health and social work activities,CC,IN,http://securityaffairs.co/wordpress/55535/cyber-crime/national-aids-research-institute-nari-hack.html,"nari-icmr.res.in, Sc0rp10nGh0s7"
56,21/01/2017,?,Sundance Film Festival,The box office and other systems at the Sundance Film Festival are shut down by hackers.,DDoS,R Arts entertainment and recreation,CC,US,https://www.cnet.com/news/hackers-sundance-film-festival-shut-down-box-office/,Sundance Film Festival
57,22/01/2017,Chipher0007,AlphaBay,"About 218,000 unencrypted private messages posted to the AlphaBay dark web marketplace are accessed and released to the public.",Undisclosed Vulnerabilities,G Wholesale and retail trade,CC,N/A,https://www.scmagazine.com/alphabay-dark-web-marketplace-users-compromised/article/634111/,AlphaBay. Chipher0007
58,22/01/2017,OurMine,New York Times Video Twitter Account (@nytvideo),OurMine hacks the Twitter account of New York Time Video (@nytvideo) and posts fake news.,Account Hjiacking,J Information and communication,CC,US,http://securityaffairs.co/wordpress/55580/cyber-crime/new-york-times-hacked.html,"New York Times Video Twitter Account, @nytvideo, OurMine"
59,23/01/2017,?,Lloyds Bank,The Financial Time reveals that Lloyds Bank has been targeted by a large scale DDoS attack over the past two weeks. Two crooks claims responsibility for the attack.,DDoS,K Financial and insurance activities,CC,GB,http://www.zdnet.com/article/lloyds-bank-services-hit-by-denial-of-service-attack/,Lloyds Bank
60,23/01/2017,?,Several targets in Saudi Arabia,Saudi Arabia warns organizations in the Kingdom to be on the alert for cyber attacks carried on via a new variant of the Shamoon virus. Targets include a chemical firm (Sadara Chemical Co) and the Ministry of Labor and Social Development.,Malware,Y Multiple targets,CW,SA,http://saudigazette.com.sa/saudi-arabia/saudi-arabia-warns-cyber-attacks-labor-ministry-hit/,"Shamoon, Sadara Chemical Co, Ministry of Labor and Social Development"
61,23/01/2017,?,XP Investimentos SA,"Hackers who stole data from 29,000 clients of XP Investimentos SA allegedly tried to get the Brazilian independent securities firm to pay 22.5 million reais ($7.1 million) to keep the security breach secret.",Industry: Securities,Z Unknown,CC,BR,http://www.nasdaq.com/article/hackers-blackmail-brazil-broker-xp-over-client-data-breach-valor-20170123-01328,XP Investimentos SA
62,24/01/2017,?,Grey Eagle Resort and Casino,Grey Eagle Resort and Casino and the attackers threatne to dump hundreds of gigabytes of data. The Casino confirms the breach.,Unknown,I Accommodation and food service activities,CC,US,https://www.databreaches.net/ca-grey-eagle-resort-hackers-threaten-to-dump-sensitive-employee-and-customer-info/,Grey Eagle Resort and Casino
63,24/01/2017,?,"larisa@steamreal.ru
 ewartumba@mail.ru",Websites of the Democratic Party in the Wisconsin area are hacked by alleged Russian Hackers.,Undisclosed Vulnerabilities,N Administrative and support service activities,CC,US,http://www.usatoday.com/story/news/politics/2017/01/24/russians-suspected-hacking-wisconsin-dems/97023222/,"Democratic Party, Wisconsin, larisa@steamreal.ru, ewartumba@mail.ru"
64,25/01/2017,APT28 AKA Fancy Bear,Unnamed TV Station in the UK,SecureWorks reveals that APT28 was able to infiltrate an unnamed TV station in the UK and stay undetected for 12 months starting from July 2015.,Targeted Attack,J Information and communication,CE,GB,http://www.ibtimes.co.uk/russia-linked-fancy-bear-hackers-had-access-uk-television-station-almost-year-1603226,"APT28, Fancy Bear, SecureWorks"
