ID,Date,Author,Target,Description,Attack,Target Class,Attack Class,Country,Link,Tags
257,09/04/2017,?,Wonga,"Almost 250,000 Wonga's UK customers are affected by a data breach. The payday lender says it is investigating 'illegal and unauthorised access' to some of its customers' personal information in both Britain and Poland. Stolen data may include account numbers, sort codes, addresses and the last four digits of users' bank cards.",Unknown,K Financial and insurance activities,CC,UK,http://www.dailymail.co.uk/sciencetech/article-4395646/British-lender-Wonga-warns-customers-personal-data-hack.html,Wonga
258,10/04/2017,?,Microsoft Word Users,Proofpoint reveals that an unpatched zero-day vulnerability impacting every version of Microsoft Word has been exploited by hackers to spread a notorious banking Trojan called Dridex to millions of users around the world.,RCE Vulnerability,X Individual,CC,>1,http://www.ibtimes.co.uk/millions-microsoft-word-users-hit-banking-virus-exploiting-unpatched-vulnerability-1616473,"Proofpoint, RCE Vulnerability"
259,10/04/2017,Longhorn,At least 40 governments and private organizations across 16 countries,Security Experts from Symantec reveals that the Longhorn group has targeted at least 40 governments and private organizations across 16 countries using the tools detailed in the recent Vault 7 leak.,Targeted Attack,"O Public administration and defence, compulsory social security",CE,>1,http://securityaffairs.co/wordpress/57916/apt/longhorn-group-cia.html,"Symantec, Longhorn, Vault 7"
260,10/04/2017,?,Amazon third-party sellers,"Amazon third-party sellers, are hit repeatedly by hackers who post fake deals on legitimate sellers' pages.",Account Hijacking,J Information and communication,CC,US,https://www.wsj.com/articles/amazon-coms-third-party-sellers-hit-by-hackers-1491816600,Amazon
261,11/04/2017,North Korean Hackers,Union Bank of India,"North Korean hackers are suspected of attempting to steal $170m from Union Bank of India, back in 2015.",Malware,K Financial and insurance activities,CC,IN,http://www.ibtimes.co.uk/north-korean-hackers-may-have-launched-bangladesh-bank-style-cyberattack-indian-bank-1616419,"North Korea, Union Bank of India"
262,12/04/2017,?,AQA (Assessment and Qualifications Alliance),"Data relating to 64,000 current and former examiners stored on some of AQA’s online systems are stolen by attackers, including examiners’ name, address, personal phone numbers, and passwords.",Unknown,P Education,CC,UK,http://schoolsweek.co.uk/thousands-of-examiners-personal-details-stolen-in-aqa-cyber-attack/,"AQA, Assessment and Qualifications Alliance"
263,13/04/2017,Callisto Group,>1,"F-Secure reveals the details of Callisto Group, a mysterious hacking collective known to target military personnel, government officials, think tanks and journalists, and also reportedly responsible for a series of cyber-espionage attacks against targets including the UK Foreign Office last year",Targeted Attack,Y Multiple targets,CE,>1,http://www.ibtimes.co.uk/mysterious-cyber-spy-group-linked-targeted-hack-attacks-uk-foreign-office-1616948,"F-Secure, Calisto Group"
264,13/04/2017,?,Airbnb users,An Airbnb investigation finds that several peoples' homes were robbed by guests using stolen accounts.,Account Hijacking,X Individual,CC,>1,http://www.bbc.com/news/av/technology-39589241/airbnb-account-hijackers-burgle-homes,Airbnb
265,13/04/2017,?,Melbourne IT,Australian ISP Melbourne IT confirms that it was hit by “a large DDoS attack” that disrupted its web hosting.,DDoS,J Information and communication,CC,AU,https://www.infosecurity-magazine.com/news/australian-isp-fights-ddos-attack/,Melbourne IT
266,13/04/2017,OurMine,hundreds of popular Youtube channels,The OurMine collective compromises hundreds of popular Youtube channels.,Account Hijacking,X Individual,CC,>1,https://www.hackread.com/ourmine-hacks-hundreds-of-youtube-accounts/,"OurmMine, Youtube"
267,14/04/2017,?,Best American Hospitality Corp.,Best American Hospitality Corp. issues a statement regarding stolen payment cards at some of the restaurants it manages and operates:,Malware,I Accommodation and food service activities,CC,US,https://finance.yahoo.com/news/best-american-hospitality-corp-issues-205500532.html,Best American Hospitality Corp.
268,14/04/2017,The Shadow Brokers,NSA,"The Shadow Brokers dumpe a new collection of files, containing what appears to be exploits and hacking tools targeting Microsoft's Windows OS and evidence the Equation Group had gained access to servers and targeted the SWIFT banking system of several banks across the world.",Unknown,"O Public administration and defence, compulsory social security",CE,US,https://www.bleepingcomputer.com/news/security/shadow-brokers-publish-the-password-for-the-rest-the-stolen-nsa-hacking-tools/,"The Shadow Brokers, NSA"
269,14/04/2017,?,Britain First,"Britain First is hit by a massive hack that targeting its websites and Twitter accounts, and their YouTube channel.",Account Hijacking,N Administrative and support service activities,CC,GB,http://www.huffingtonpost.co.uk/entry/britain-first-hacked_uk_58f0ccf6e4b0bb9638e323ab,Britain First
270,14/04/2017,?,Several Celebrities,"Hackers leake nude pictures and explicit videos of celebrities including Rosario Dawson, Miley Cyrus, Suki Waterhouse, Kate Hudson and Yvonne Strahovski.",Unknown,X Individual,CC,>1,https://www.hackread.com/hacked-nude-photos-of-rosario-dawson-miley-cyrus-leaked/,"Rosario Dawson, Miley Cyrus, Suki Waterhouse, Kate Hudson, Yvonne Strahovski."
271,15/04/2017,?,Youku,"A dark web vendor going by the handle of CosmicDark sells a database containing 100,759,591 user accounts stolen from of Youku Inc., a popular video service in China.",Unknown,J Information and communication,CC,CN,https://www.hackread.com/chinese-video-service-youku-hacked-accounts-sold-on-darkweb/,"Youku, CosmicDark, Youku"
272,10/04/2017,Janitor,Sierra Tel,"The Bricker Bot takes down the Zyxel HN-51 Modem belonging to Sierra Tel, a Californian ISP.",Malware,J Information and communication,CC,US,https://www.bleepingcomputer.com/news/security/us-isp-goes-down-as-two-malware-families-go-to-war-over-its-modems/,"Sierra Tel, Bricker Bot, Janitor, Zyxel HN-51"
273,11/04/2017,?,eConcordia,"Concordia’s online course systems, eConcordia and KnowledgeOne, are hacked, 9000 users are compromised.",Account Hijacking,P Education,CC,US,https://thelinknewspaper.ca/article/econcordia-system-hacked,eConcordia
274,16/04/2017,?,McAfee Linkedin Page,The LinkedIn page for McAfee is hijacked by a single person or an unknown number of individuals allegedly affiliated with the OurMine collective.,Account Hijacking,J Information and communication,CC,US,http://www.csoonline.com/article/3190163/security/mcafee-linkedin-page-hijacked.html,"McAfee, Linkedin, OurMine"
275,16/04/2017,?,Westminster College,Westminster College in Missouri reveals the details of a breach discovered on March 26 after a phishing scam duped a staffer into sending off W-2 statements.,Account Hijacking,P Education,CC,US,https://www.scmagazine.com/w-2-data-breach-at-westminster-college/article/650860/,Westminster College
276,18/04/2017,?,Northrop Grumman,"Northrop Grumman admits one of its internal portals was broken into, exposing employees' sensitive tax records to W-2 Scams.",Account Hijacking,C Manufacturing,CC,US,https://www.theregister.co.uk/2017/04/24/northrop_grumman_breach_worker_w2s/,"Northrop Grumman, W-2"
277,18/04/2017,?,"Retina-X
 FlexiSpy","Motherboard obtains the data of 130,000 customers of the two mobile surveillance software firms Retina-X and FlexiSpy",Unknown,J Information and communication,CC,US,https://motherboard.vice.com/en_us/article/inside-stalkerware-surveillance-market-flexispy-retina-x,"Retina-X,FlexiSpy, Motherboard"
278,20/04/2017,?,Android users,"Researchers from Trend Micro discover MilkyDoor, an alleged successor of the infamous malware DressCode.",Malware,X Individual,CC,>1,http://blog.trendmicro.com/trendlabs-security-intelligence/dresscode-android-malware-finds-successor-milkydoor/,"Trend Micro, MilkyDoor, DressCode"
279,20/04/2017,?,Fashion Fantasy Game,"A 2016 data breach leaves Fashion Fantasy Game, an online game and social network for fashion lovers, with millions of user account credentials being leaked on the web.",Unknown,R Arts entertainment and recreation,CC,US,http://www.zdnet.com/article/amid-data-breach-responsibility-thrown-to-the-wind/,Fashion Fantasy Game
280,21/04/2017,APT10 and Tonto team,South Korea,FireEye claims Chinese hackers are trying to break into South Korea's military to halt the deployment of an anti-ballistic weapons system in the country.,Targeted Attack,"O Public administration and defence, compulsory social security",CW,KP,https://www.theregister.co.uk/2017/04/21/china_accused_south_korea_hack/,"APT10, Tonto team, FireEye, South Korea, China"
281,21/04/2017,?,Atlantic Digestive Specialists,Atlantic Digestive Specialists notify patients of ransomware incident,Malware,Q Human health and social work activities,CC,US,https://www.databreaches.net/atlantic-digestive-specialists-notify-patients-of-ransomware-incident/,"Atlantic Digestive Specialists, Ransomware"
282,21/04/2017,?,Cleveland Metropolitan School District,Cleveland Metropolitan School District discloses phishing-related incident,Account Hijacking,P Education,CC,US,https://www.databreaches.net/cleveland-metropolitan-school-district-discloses-phishing-related-incident/,Cleveland Metropolitan School District
283,21/04/2017,?,Iowa Veterans Home,"Iowa Veterans Home warns nearly 3,000 of data breach after phishing incident",Account Hijacking,"O Public administration and defence, compulsory social security",CC,US,https://www.databreaches.net/iowa-veterans-home-warns-nearly-3000-of-data-breach-after-phishing-incident/,Iowa Veterans Home
284,22/04/2017,?,Alison Brie,Fappening 2.0 continues: this time Alison Brie is targeted and has some nude images leaked online.,Unknown,X Individual,CC,US,http://www.ibtimes.co.uk/fappening-2-0-leak-celebrity-nudes-continues-alison-brie-targeted-by-hacker-1618338,"Alison Brie, Fappening 2.0"
285,22/04/2017,?,Yapizon,"Yapizon, a South Korean Bitcoin exchange suffers a massive data breach when hackers steal 3,800 Bitcoin (US$5 million) which is 37% of user funds.",Unknown,V Fintech,CC,KR,https://www.hackread.com/south-korean-bitcoin-exchange-yapizon-hacked/,Yapizon
286,23/04/2017,Zhengquan Zhang,KCG Holdings,"The FBI arrests Zhengquan Zhang, a 31-year-old IT engineer, accused of installing malware on his employer's servers to steal proprietary source.",Malware,K Financial and insurance activities,CC,US,https://www.bleepingcomputer.com/news/security/wall-street-it-engineer-hacks-employer-to-see-if-he-will-be-let-go/,"Zhengquan Zhang, KCG Holdings"
287,23/04/2017,Ayyildiz Tim,North Mundham Primary in Chichester,Police are investigating after “malicious” messages are left on a school website by Turkish nationalists in an apparent hacking attempt.,Defacement,P Education,CC,UK,https://www.thesun.co.uk/news/3397114/sussex-school-website-hacked-with-malicious-messages-sparking-police-investigation/,"North Mundham Primary in Chichester, Ayyildiz Tim"
288,24/04/2017,APT28 AKA Fancy Bear,Danish Armed Forces,"Denmark’s security service, Politiets Efterretningstjeneste’s (PET) Centre for Cyber Security says in its report that Danish armed forces personnel have their emails hacked over the last two years. The hack has been attributed to ‘Fancy Bear'.",Targeted Attack,"O Public administration and defence, compulsory social security",CE,DK,https://www.rt.com/viral/385987-danish-hack-fancy-bear/,"APT28, Fancy Bear, Politiets Efterretningstjeneste, PET"
289,24/04/2017,?,7 Southeast Asian Nations,"An anti-cybercrime operation by Interpol and investigators from seven southeast Asian nations reveal nearly 9,000 malware-laden servers and hundreds of compromised websites in the ASEAN region.",Malware,Y Multiple targets,CC,>1,http://uk.reuters.com/article/us-singapore-interpol-cyber-idUKKBN17Q1BT,Interpol
290,24/04/2017,?,HipChat,"HipChat is hacked over the weekend due to a vulnerability in a third-party library. The incident affects a server in the HipChat Cloud web tier, and for a small number of instances (less than 0.05 percent), there's evidence messages and content in rooms may have been accessed.",Vulnerability in a third-party library,J Information and communication,CC,US,http://www.zdnet.com/article/hipchat-hacked-user-account-info-and-some-user-content-potentially-compromised/,HipChat
291,24/04/2017,?,City of Newark,"A ransomware attack hits some municipal computers in New Jersey's most populous city, Newark.",Malware,"O Public administration and defence, compulsory social security",CC,US,https://www.scmagazine.com/city-of-newark-reportedly-hit-in-ransomware-attack/article/652644/,"Newark, Ransomware"
292,24/04/2017,?,Greenway Health,Greenway Health is the victim of a ransomware attack,Malware,Q Human health and social work activities,CC,US,https://www.databreaches.net/greenway-health-reports-ransomware-attack/,"Greenway Health, Ransomware"
293,25/04/2017,?,Chipotle,"Chipotle, the global fast-food chain specialising in Mexican dishes, urges its US customers to check for suspicious activity on their bank statements after ""unauthorised"" activity on its payment processing systems has led to fears the company has been hacked.",PoS Malware,I Accommodation and food service activities,CC,US,http://www.ibtimes.co.uk/chipotle-spills-beans-about-month-long-cyberattack-credit-card-systems-1618764,Chipotle
294,25/04/2017,APT28 AKA Fancy Bear,Two German think tanks with ties to Christian Democratic Union (CDU) and Social Democratic Party (SPD).,Trend Micro reveals that Kremlin-linked Fancy Bear hackers targeted two German think tanks with ties to Angela Merkel's ruling coalition parties Christian Democratic Union (CDU) and Social Democratic Party (SPD).,Targeted Attack,N Administrative and support service activities,CE,DE,http://www.ibtimes.co.uk/fancy-bear-hackers-ramp-attacks-against-german-think-tanks-key-european-elections-approach-1618648,"APT28, Fancy Bear, Christian Democratic Union, CDU, Social Democratic Party, SPD"
295,25/04/2017,APT28 AKA Fancy Bear,Emmanuel Macron,The same reports reveals that French presidential candidate Emmanuel Macron was targeted by APT28.,Targeted Attack,X Individual,CE,FR,http://www.ibtimes.co.uk/french-elections-russian-hacking-group-fancy-bear-targeted-macron-through-phishing-attacks-1618449,"APT28, Fancy Bear, Emmanuel Macron"
296,25/04/2017,?,R2Games,"Online gaming company Reality Squared Games (R2Games) is compromised for the second time in two years and more than one million accounts are compromised. Leaked data includes usernames, passwords, email addresses, IP addresses, and other optional record fields, such as instant messenger IDs, birthday, and Facebook related details (ID, name, access token).",Unknown,R Arts entertainment and recreation,CC,CN,http://www.csoonline.com/article/3192246/security/r2games-compromised-again-over-one-million-accounts-exposed.html,R2Games
297,25/04/2017,?,Multiple Japanese Businesses,"Cybereason discovers ShadowWali, a backdoor used for targeted attacks, against Japanese businesses since at least 2015.",Targeted Attack,Y Multiple targets,CE,JP,https://www.infosecurity-magazine.com/news/shadowwali-malware-discovered/,"Cybereason, ShadowWali"
298,25/04/2017,?,Blowout Cards,"Blowout Cards issues a security alert to customers, warning that their payment card details may have been compromised after an attacker hacked its website and customers began reporting related card fraud.",Malware,J Information and communication,CC,US,http://www.databreachtoday.com/blowout-cards-issues-card-skimming-breach-alert-a-9864,
299,25/04/2017,WauchulaGhost,250 ISIS Twitter Accounts,WauchulaGhost defaces 250 ISIS Twitter accounts with adult content.,Defacement,S Other service activities,H,N/A,http://news.softpedia.com/news/hacktivist-defaces-250-isis-twitter-accounts-with-adult-content-515153.shtml,"WauchulaGhost, ISIS, Twitter"
300,26/04/2017,?,Android users,"Check Point updates the damage report for the FalseGuide malware with five additional apps found containing the malware, estimating that 2 million Android users have unknowingly downloaded the malware.",Malware,X Individual,CC,>1,http://www.zdnet.com/article/falseguide-malware-victim-count-jumps-to-2-million/,"Check Point, Android, FalseGuide"
301,26/04/2017,OilRig,120 Israeli Targets,"The Israeli Government reveals to have thwarted a major cyberattack against 120 targets. Israeli sources believe the attack has been launched by the Iran-linked OilRig APT group (aka Helix Kitten, NewsBeef ).",Targeted Attack,"O Public administration and defence, compulsory social security",CC,IL,http://securityaffairs.co/wordpress/58464/hacking/oilrig-apt-target-israel.html,"OilRig, Helix Kitten, NewsBeef"
302,26/04/2017,?,Ciphr,Customer data from encrypted phone company Ciphr is dumped online.,Unknown,C Manufacturing,CC,US,https://motherboard.vice.com/en_us/topic/data-dump,Ciphr
303,26/04/2017,?,Virginia Sex Offender and Crimes Against Children Registry (SOR),"A malware infection affecting servers belonging to the Virginia State Police (VSP) shuts down the department's email system, along with its ability to update the Virginia Sex Offender and Crimes Against Children Registry (SOR).",Malware,"O Public administration and defence, compulsory social security",CC,US,https://www.bleepingcomputer.com/news/security/malware-blocks-virginia-state-police-from-updating-sex-offender-registry/,"Virginia Sex Offender and Crimes Against Children Registry, SOR"
304,26/04/2017,?,Pekin Community High School,A ransomware attack takes down Pekin Community High School.,Malware,P Education,CC,US,https://www.databreaches.net/il-pekin-high-school-hit-by-ransomware-and-37000-demand/,"Pekin Community High School, Ransomware"
305,27/04/2017,?,>1,Reuters reveals that unknown attackers have been exploiting CVE-2017-0199 against target in Ukraina and Australia.,Targeted Attack,Y Multiple targets,CE,"UA
 AU",http://uk.reuters.com/article/us-microsoft-cyber-idUKKBN17S32G,"Reuters, Microsoft, CVE-2017-0199"
306,27/04/2017,?,OSX Users,"Check Point reveals the details of OSX/Dok, a new malware affecting all versions of OSX, signed with a valid developer certificate (authenticated by Apple), the first major scale malware to target OSX users via a coordinated email phishing campaign.",Malware,X Individual,CC,>1,http://blog.checkpoint.com/2017/04/27/osx-malware-catching-wants-read-https-traffic/,"OSX/Dok, Check Point"
307,27/04/2017,?,NoTrove,"RiskIQ reveals that a group known as NoTrove is driving massive amounts of traffic to survey pages, scams sites, and shady software download portals, so much so that one of the domains they used in their campaings peaked at #517 in Amazon's Alexa traffic ranking.",Malvertising,X Individual,CC,>1,https://www.bleepingcomputer.com/news/security/malvertising-domain-had-so-much-traffic-it-reached-517-in-the-alexa-ranking/,"RiskIQ, NoTrove"
308,28/04/2017,The Dark Overlord,Netflix,"TheDarkOverlord leaks upcoming episode of Orange is the New Black after Netflix doesn’t pay extortion demand. The hack happened via a ""production vendor"".",Unknown,R Arts entertainment and recreation,CC,US,https://www.databreaches.net/thedarkoverlord-leaks-upcoming-episode-of-orange-is-the-new-black-after-netflix-doesnt-pay-extortion-demand/,"The Dark Overlord, Netflix, Orange is the new black"
309,28/04/2017,Evaldas Rimasauskas,Google and Facebook,Google and Facebook confirm that they fell victim to an alleged $100m (£77m) scam between 2013 and 2015.,Account Hijacking,J Information and communication,CC,US,http://www.bbc.co.uk/news/technology-39744007,"Evaldas Rimasauskas, Google, Facebook"
310,28/04/2017,?,20 UK Banks,"Security researchers from IBM Security warn that a strain of banking Trojan, dubbed TrickBot, is escalating attacks against UK banks and financial institutions. The operators of the malware have launched five campaigns only on April.",Malware,K Financial and insurance activities,CC,UK,http://www.ibtimes.co.uk/trickbot-malware-now-targeting-20-new-uk-banks-fresh-cybercrime-spree-ibm-warns-1619186,"IBM Security, TrickBot"
311,28/04/2017,?,Diamond Institute for Infertility and Menopause,"Diamond Institute for Infertility and Menopause notifies patients of an incident involving their electronic health records server, maintained by an unnamed third party. The incident happened in February",Unknown,Q Human health and social work activities,CC,US,https://www.databreaches.net/diamond-institute-for-infertility-and-menopause-notifies-patients-after-hack/,Diamond Institute for Infertility and Menopause
312,28/04/2017,Tsar Team,Grozio Chirurgija,"Cybercriminals steal 25,000 personal records and photos of patients from the data system of a Lithuanian plastic surgery clinic and put them up for sale.",OpenCMS Vulnerability,Q Human health and social work activities,CC,LT,https://www.occrp.org/en/daily/6387-lithuania-cybercriminals-blackmail-plastic-surgery-clinic-with-stolen-photos,"Grozio Chirurgija, Tsar Team"
313,29/04/2017,?,Hill Country Memorial Hospital,Hill Country Memorial Hospital notifies patients after employee email accessed without authorization,Account Hijacking,Q Human health and social work activities,CC,US,https://www.databreaches.net/hill-country-memorial-hospital-notifies-patients-after-employee-email-accessed-without-authorization/,Hill Country Memorial Hospital
314,29/04/2017,?,Greenwood County School District 50,"About 3,300 are affected by a security breach after the school discovers that an unauthorized user logged in to four Greenwood County School District 50 employees’ emails as well as current and former employees’ payroll accounts in January and February.",Account Hijacking,P Education,CC,US,https://www.databreaches.net/sc-greenwood-county-school-district-50-notifies/,Greenwood County School District 50
315,30/04/2017,?,Some IBM flash drives,IBM detects that some USB flash drives containing the initialization tool shipped with several IBM Storwize systems contain a file that has been infected with malicious code and ask users to destroy them.,Malware,C Manufacturing,CC,US,https://www.theregister.co.uk/2017/04/30/ibm_storwize_arrays_usb_shipped_with_malware_on_usb_drives/,"IBM, Storwize"
316,30/04/2017,?,Unity 3D Forum,OurMine hackers deface the official domain of Unity 3D Forums leaving a deface page along with a note.,Defacement,M Professional scientific and technical activities,CC,US,https://www.hackread.com/ourmine-hacking-group-hacks-unity-3d-forums/,"OurMine, Unity 3D Forum"
317,02/05/2017,?,Gannett Co.,"A phishing email attack potentially compromises the accounts of as many as 18,000 current and former employees of media company Gannett Co.",Account Hijacking,J Information and communication,CC,US,https://www.usatoday.com/story/tech/news/2017/05/02/gannett-hit-email-phishing-attack/101200110/,Gannett
318,02/05/2017,?,HandBrake,"Tthe popular DVD-ripping HandBrake app, is hacked to installi a new variant of the Proton malware.",Malware,S Other service activities,CC,FR,http://www.ibtimes.co.uk/handbrake-mirror-download-server-hacked-serve-malware-mac-users-1620495,"HandBrake, Proton"
319,02/05/2017,?,Android users,"Sophos reveals the details of Super Free Music Player, a fake music player app in the Google Play Store, downloaded by thousands of users since March 31st, and riddled with malware.",Mobile Malware,X Individual,CC,>1,https://nakedsecurity.sophos.com/2017/05/02/super-free-music-player-in-google-play-is-malware-a-technical-analysis/,"Sophos, Super Free Music Player"
320,02/05/2017,?,UK Banks,DomainTools reveals that hundreds of fake website domains are being used by hackers to mimic some of the most popular banking services in the UK in an attempt to trick victims into handing over personal details and sensitive login credentials.,Domain Squatting,K Financial and insurance activities,CC,UK,http://www.ibtimes.co.uk/hackers-using-cybersquatting-tactics-spoof-websites-uks-biggest-banks-1619769,DomainTools
321,02/05/2017,?,Sabre Corp. Hospitality Unit,"Travel industry giant Sabre Corp. disclosed what could be a significant breach of payment and customer data tied to bookings processed through a reservations system that serves more than 32,000 hotels and other lodging establishments.",Malware,I Accommodation and food service activities,CC,US,https://krebsonsecurity.com/2017/05/breach-at-sabre-corp-s-hospitality-unit/,Sabre Corporation
322,02/05/2017,?,City of Fitchburg,"Fitchburg, Mass. city officials report that the Social Security numbers of 1,800 residents were compromised during a data breach that was discovered on April 14, but took place more than three years ago.",Unknown,"O Public administration and defence, compulsory social security",CC,US,https://www.scmagazine.com/fitchburg-mass-officials-discover-three-year-old-breach-affecting-1800/article/654317/,Fitchburg
323,02/05/2017,?,Wellington's Victoria University,Students and staff of Wellington's Victoria University have been warned their usernames and passwords may have been compromised following a data breach following an unauthorised access to the university's IT systems.,Unknown,P Education,CC,NZ,http://www.stuff.co.nz/technology/92121891/student-data-potentially-compromised-after-victoria-university-it-system-hacked,Wellington's Victoria University
324,03/05/2017,?,Gmail users,A massive phishing campaign hits Google users and compromises about a million of its accounts exploiting a fake app abusing the Oauth authentication protocol.,Account Hijacking via Oauth,X Individual,CC,>1,http://www.bbc.co.uk/news/business-39798022,"Google, Oauth, Gmail"
